idiom,meaning
벌 집 을 건드리,건드리 어서 는 안 되 ᆯ 것 을 공연히 건드리 ㅓ 크 ᆫ 화근 을 만들
벌 집 을 쑤시,건드리 어서 는 안 되 ᆯ 것 을 공연히 건드리 ㅓ 크 ᆫ 화근 을 만들
벌 통 쑤시 ᆫ 것 같,매우 어수선 하
범 의 아가리,매우 위태 하 ᆫ 지경
범 의 아가리 를 벗어나,매우 위급 하 ᆫ 경우 를 벗어나
범 의 입 을 벗어나,매우 위급 하 ᆫ 경우 를 벗어나
범 의 어금 니,없 어서 는 안 되 ᆯ 매우 요긴 하 ᆫ 것
범 의 차반,무엇 이 생기 면 아끼 어 쓰 며 모으 아 두 ᆯ 생각 은 없이 생기 는 대로 다 쓰 어 버리 ᆫ다
범 한테 쫓기 ᆫ 사람,무엇 이 ᆫ 가 에 혼쭐 이 나 서 겁 을 먹 고 조급 하 게 서두르 거나 안절부절 못 하 는 사람
법석 이 일 이 다,소란 스럽 게 떠드 는 현상 이 생기
법 없이 살,마음 이 곧 고 착하 여 법 의 규제 가 없 어도 나쁘 ᆫ 짓 을 하 지 아니하
벗 바리 좋,뒷 배 를 보 아 주 는 사람 이 많
벗 바리 가 좋,뒷 배 를 보 아 주 는 사람 이 많
베 개 를 높이 베,안심 하 고 편안 하 게 푹 자 거나 태평 스럽 게 지내
베 개 를 높이 하,안심 하 고 편안 하 게 푹 자 거나 태평 스럽 게 지내
베이스 넣,옆 에서 남 의 말 을 거들 어 주
베이스 를 넣,옆 에서 남 의 말 을 거들 어 주
베 틀 에 북 나들 ᆯ 듯,부리나케 자주 드나드 는 모양 이
벼락 내리,크 ᆫ 벌 을 받
벼락 떨어지,크 ᆫ 벌 을 받
벼락 이 내리,크 ᆫ 벌 을 받
벼락 이 떨어지,크 ᆫ 벌 을 받
벼락 맞 을 소리,천 벌 을 받 아 마땅 하 ᆯ 만큼 당찮 은 말
벼락 불 치,매우 빠르 거나 세 게 치 는 모양
벼락 치,아주 빠르 게
벼랑 에 몰리,위험 하 ᆫ 상황 에 직면 하 게 되
벼룩 의 불 알 만 하,매우 작
벼슬 길 에 오르,벼슬 살이 를 시작 하
벽 쌓,서로 사귀 던 관계 를 끊
벽 을 쌓,서로 사귀 던 관계 를 끊
벽 에 부딪치,어떤 장애 물 에 가로막히
벽 을 알 ㄴ다,벽 을 향하 여 가까이 하
변덕 이 죽 끓 듯 하,말 이나 행동 을 몹시 이러 었 다가 저러 었 다가 하
변두 놓,편두 통 을 고치 기 위하 여 침 을 놓
변두 를 놓,편두 통 을 고치 기 위하 여 침 을 놓
변두 맞,편두 통 을 고치 기 위하 여 침 을 맞
변두 를 맞,편두 통 을 고치 기 위하 여 침 을 맞
변죽 울리,바로 집 어 말 을 하 지 않 고 둘러서 어 말 을 하
변죽 을 울리,바로 집 어 말 을 하 지 않 고 둘러서 어 말 을 하
변죽 을 치,바로 집 어 말 을 하 지 않 고 둘러서 어 말 을 하
변죽 치 고 넘,화살 이 과녁 의 변죽 을 맞 고 밖 으로 튕기 어 나가
별 겯,별 이 총총 박히
별 보 ᆯ 일 없,대단 하 지 않 고 하찮
별 보 ᆯ 일 있,보통 과 구별 되게 다르
별 이 보이,충격 을 받 아서 갑자기 정신 이 아득 하 고 어지럽
병 나발 불,나발 을 불 듯이 병 을 거꾸로 입 에 대 고 병 속 에 들 ᆫ 액체 를 들이켜
병 나발 을 불,나발 을 불 듯이 병 을 거꾸로 입 에 대 고 병 속 에 들 ᆫ 액체 를 들이켜
병신 육갑 하,되 지 못하 ᆫ 자 가 엉뚱 하 ᆫ 짓 을 하
병신 이 육갑 六甲 하,되 지 못하 ᆫ 자 가 엉뚱 하 ᆫ 짓 을 하
병아리 보 ᆫ 솔개,기다리 던 때 나 사물 을 차지 하 려고 기회 를 노리 는 사람
병아리 를 보 ᆫ 솔개,기다리 던 때 나 사물 을 차지 하 려고 기회 를 노리 는 사람
병아리 눈 물 만큼,매우 적 은 수량
병아리 오줌,정신 이 희미 하 고 고리타분 하 ᆫ 사람
병 자년 방죽 이,건방지
보금 자리 치,보금 자리 를 만들
보금 자리 를 치,보금 자리 를 만들
보 기 좋 게,남 이 낭패 보 ᆫ 것 을 고소 해하 하
보 는 눈 이 있,사람 이나 일 따위 를 평가 하 는 능력 이 있
보 따리 싸,관계 하 던 일 이나 다니 던 직장 을 완전히 그만두
보 따리 를 싸,관계 하 던 일 이나 다니 던 직장 을 완전히 그만두
보 따리 풀,숨 은 사실 을 폭로 하
보 따리 를 풀,숨 은 사실 을 폭로 하
보 란 듯이,남 이 보 고 부럽 어 하 도록 자랑 스럽 거나 떳떳 하 게
보리 타,매 를 맞
보리 를 타,매 를 맞
보 쌈 에 들,남 의 꾀 에 걸려들
보 자 보 자 하,마음 에 들 지 않 지만 참 고 또 참
보통 아니,평범 하 지 아니하 고 솜씨 가 특별 하 거나 뛰어나
보통 이 아니,평범 하 지 아니하 고 솜씨 가 특별 하 거나 뛰어나
복 벗,복제 에 따르 아 첫 1 년 동안 상복 을 입 도록 되 어 있 는 기간 이 지나가
복 을 벗,복제 에 따르 아 첫 1 년 동안 상복 을 입 도록 되 어 있 는 기간 이 지나가
복 입,복제 에 따르 아 첫 1 년 동안 입 도록 되 어 있 는 상복 을 입
복 을 입,복제 에 따르 아 첫 1 년 동안 입 도록 되 어 있 는 상복 을 입
복 가마 타,뜻 하 지 않 은 행복 을 얻
복 가마 를 타,뜻 하 지 않 은 행복 을 얻
복 의 배,배 가 나오 ᆫ 사람
복장 긁,성 이 나 게 하
복장 을 긁,성 이 나 게 하
복장 뒤집,성 이 나 게 하
복장 을 뒤집,성 이 나 게 하
복장 뒤집히,성 이 나
복장 이 뒤집히,성 이 나
복장 타,걱정 이 되 거나 안타깝 어 마음 이 몹시 달
복장 이 타,걱정 이 되 거나 안타깝 어 마음 이 몹시 달
복장 터지,몹시 마음 에 답답 하 ᄆ 을 느끼
복장 이 터지,몹시 마음 에 답답 하 ᄆ 을 느끼
복장 을 짓찧,마음 에 몹시 심하 ᆫ 고통 을 주
복정 씌우,남 에게 억지로 부담 을 지우
복정 을 씌우,남 에게 억지로 부담 을 지우
복정 안기,남 에게 억지로 부담 을 지우
복정 을 안기,남 에게 억지로 부담 을 지우
복정 알 ㄴ다,억지로 맡 아 부담 하
복정 을 알 ㄴ다,억지로 맡 아 부담 하
복학 잡,복학 을 완전히 낫 게 하
복학 을 잡,복학 을 완전히 낫 게 하
본때 를 보이,잘못 을 다시 는 저지르 지 아니하 거나 교훈 이 되 도록 따끔 하 ᆫ 맛 을 보이
본말 이 전도 되,중요 하 ᆫ 것 과 중요 하 지 않 은 것 이 구별 되 지 않 거나 일 의 순서 가 잘못 바뀌 ᆫ 상태 가 되
본말 이 전도 顚倒 되,중요 하 ᆫ 것 과 중요 하 지 않 은 것 이 구별 되 지 않 거나 일 의 순서 가 잘못 바뀌 ᆫ 상태 가 되
본보 기 를 내,여러 사람 을 경계 하 기 위하 여 잘못 하 ᆫ 사람 을 징계 하 여 본보 기 가 되게 하
본전 도 못 찾,일 한 결과 가 좋 기 는커녕 오히려 하 지 아니하 ᆫ 것 만 도 못하
볼 붓,못 마땅 하 여 뾰로통 하 게 성 이 나
볼 이 붓,못 마땅 하 여 뾰로통 하 게 성 이 나
볼 꼴 좋,꼴 이 보 기 에 흉하
볼 에 밤 을 물,못 마땅 하 여 뾰로통 하 게 성 이 나
볼 을 적시,눈 물 을 흘리
보 ᆯ 장 다 보,일 이 더 손 대 ㄹ 것 도 없이 틀어지
보 ᆯ 장 을 다 보,일 이 더 손 대 ㄹ 것 도 없이 틀어지
보 ᆯ 장 보다,하 고자 하 는 바 를 이루
봄 타,봄 기운 때문 에 마음 을 안정 하 지 못하 여 기분 이 들뜨
봄 을 타,봄 기운 때문 에 마음 을 안정 하 지 못하 여 기분 이 들뜨
봄 눈 스 ㄹ 듯,무엇 이 빨리 슬 어 없 어 지
봄 눈 녹,무엇 이 빨리 슬 어 없 어 지
봄 풀 자라,"걱정 , 공상 따위 가 꼬리 를 물 고 자꾸 일어나"
봇 짐 싸 아 가지 고 말리,일부러 멀리 찾아가 서 까지 못 하 게 말리
봇 짐 을 싸,살 던 곳 이나 일 하 던 곳 을 옮기 기 위하 여 짐 을 꾸리
봇 짐 을 지,필요 하 ᆫ 물건 이나 살림 살이 를 꾸리 어서 이사 를 가 거나 길 을 떠나
봇 짐 을 풀,거처 하 여 살 기 시작 하
봉 잡,매우 귀하 고 훌륭 하 ᆫ 사람 이나 일 을 얻
봉 을 잡,매우 귀하 고 훌륭 하 ᆫ 사람 이나 일 을 얻
봉화 들,어떤 일 이나 운동 을 맨 앞 에서 선구 적 으로 시작 하
봉화 올리,어떤 일 이나 운동 을 맨 앞 에서 선구 적 으로 시작 하
봉화 를 들,어떤 일 이나 운동 을 맨 앞 에서 선구 적 으로 시작 하
봉화 를 올리,어떤 일 이나 운동 을 맨 앞 에서 선구 적 으로 시작 하
봉화 를 일으키,어떤 일 이나 운동 을 맨 앞 에서 선구 적 으로 시작 하
부들이 를 뽑,처마 쪽 서까래 를 위 로 휘 어 오르 ᆫ 듯 하 게 깎
부레 가 끓,몹시 성나
부룩 박,곡식 이나 채소 따위 를 심 은 밭 의 사이 사이 에 다른 농작 물 을 심
부룩 치,곡식 이나 채소 따위 를 심 은 밭 의 사이 사이 에 다른 농작 물 을 심
부룩 을 박,곡식 이나 채소 따위 를 심 은 밭 의 사이 사이 에 다른 농작 물 을 심
부룩 을 치,곡식 이나 채소 따위 를 심 은 밭 의 사이 사이 에 다른 농작 물 을 심
부르 느니 말 하,가깝 ᆫ 거리 에 있 으면서 불러오 라고 시키 는 것 보다 는 마주 대 고 말 을 하 는 것 이 더 빠르
부르 는 것 이 값,값 이 일정 하 지 아니하 고 그 때 그 때 달라지
부르 는 것 이 값,값 이 일정 하 지 아니하 고 그 때 그 때 달라지
부르 는 것 이 값 이,값 이 일정 하 지 아니하 고 그 때 그 때 달라지
부르 는 것 이 값 이,값 이 일정 하 지 아니하 고 그 때 그 때 달라지
부리 가 잡히,종기 가 곪 느라고 한 가운데 가 뾰족 하 아 지
부리 를 까,말 로 만 잘 지껄이 거나 말 대꾸 를 잘 하
부리 를 따,이야기 나 일 을 시작 하 거나 손 을 대
부리 를 떼,이야기 나 일 을 시작 하 거나 손 을 대
부리 를 헐,이야기 나 일 을 시작 하 거나 손 을 대
부시 치,부싯 돌 에 부싯 깃 을 놓 고 부시 로 치 어서 불 을 일으키
부시 를 치,부싯 돌 에 부싯 깃 을 놓 고 부시 로 치 어서 불 을 일으키
부아 가 상투 끝 까지 치밀 어 오르,부아 가 몹시 치밀
부엉이 방귀 같,사소 하 ᆫ 일 에 도 잘 놀라 ᆫ다
부접 못 하,한 곳 에 붙 어 배기 거나 견디 어 내 지 못하
부접 을 못 하,한 곳 에 붙 어 배기 거나 견디 어 내 지 못하
부정 보다,꺼리 거나 피하 는 몸 으로 부정 하 ᆫ 일 을 하
부정 을 보,꺼리 거나 피하 는 몸 으로 부정 하 ᆫ 일 을 하
부정 치,"부정 풀이 를 하 ᆯ 때 , 무당 이 부정 하 ᆫ 일 을 물리치 어 버리"
부정 을 치,"부정 풀이 를 하 ᆯ 때 , 무당 이 부정 하 ᆫ 일 을 물리치 어 버리"
부정 타,부정 하 ᆫ 일 로 해 를 입
부정 을 타,부정 하 ᆫ 일 로 해 를 입
북 주,흙 으로 식물 의 뿌리 를 덮 어 주
북 을 주,흙 으로 식물 의 뿌리 를 덮 어 주
북 나 들 듯,부리나케 자주 드나들
북 이 나들 ᆯ 듯,부리나케 자주 드나들
북새 놀,여러 사람 이 부산 하 게 법석이
북새 놓,여러 사람 이 부산 하 게 법석이
북새 를 놀,여러 사람 이 부산 하 게 법석이
북새 를 놓,여러 사람 이 부산 하 게 법석이
북 장단 을 치,정황 에 따르 아 일 을 줏 대 있 게 잘 처리 하
북 장단 을 추,정황 에 따르 아 일 을 줏 대 있 게 잘 처리 하
북 장단 을 맞추,정황 에 따르 아 일 을 줏 대 있 게 잘 처리 하
북 치,무엇 을 함부로 때리 거나 두드리
북 통 지,"경 을 읽 는 동안 에 병자 가 죽 었 을 때 , 경 쟁이 가 북 을 지 고 쫓겨나"
북 통 을 지,"경 을 읽 는 동안 에 병자 가 죽 었 을 때 , 경 쟁이 가 북 을 지 고 쫓겨나"
북 통 지우,"경 을 읽 는 동안 에 병자 가 죽 었 을 때 , 경 쟁이 에게 북 을 짓 어 쫓아내"
북 통 을 지우,"경 을 읽 는 동안 에 병자 가 죽 었 을 때 , 경 쟁이 에게 북 을 짓 어 쫓아내"
분위기 있,그윽 하 거나 멋있 는 기운 이 감돌
분의 를 따,자신 의 분수 에 알맞 은 정당 하 ᆫ 도리 를 저버리
분이 꼭두 까지 나,분하 ᆫ 마음 이 몹시 일어나
분이 꼭두 까지 올라오,분하 ᆫ 마음 이 몹시 일어나
분초 를 다투,아주 짧 은 시간 이 라도 아끼 어 급하 게 서두르
분초 를 아끼,시간 을 헛되 ᄆ 이 없이 효과 적 으로 쓰
분필 가루 를 먹,가르치 는 일 을 직업 으로 하
분하 ᆫ 있,많 은 것 같 아도 실상 은 그리 많 지 않
분한 이 있,많 은 것 같 아도 실상 은 그리 많 지 않
불 놓,광산 에서 폭약 을 터뜨리 려고 도화 선 에 불 을 붙이
불 을 놓,광산 에서 폭약 을 터뜨리 려고 도화 선 에 불 을 붙이
불 맞,탄 알 에 맞
불 을 맞,탄 알 에 맞
불 받,남 에게 크 ᆫ 모욕 을 당하 거나 재해 를 입
불 을 받,남 에게 크 ᆫ 모욕 을 당하 거나 재해 를 입
불 보 듯 뻔하,앞 으로 일어나 ᆯ 일 이 의심 하 ᆯ 여지 가 없이 아주 명백 하
불 보 듯 훤 하,앞 으로 일어나 ᆯ 일 이 의심 하 ᆯ 여지 가 없이 아주 명백 하
불 을 보 듯 뻔하,앞 으로 일어나 ᆯ 일 이 의심 하 ᆯ 여지 가 없이 아주 명백 하
불 을 보 듯 훤 하,앞 으로 일어나 ᆯ 일 이 의심 하 ᆯ 여지 가 없이 아주 명백 하
불 주,남 에게 크 ᆫ 곤욕 이나 해 를 입히
불 을 주,남 에게 크 ᆫ 곤욕 이나 해 를 입히
불 이 ᆯ 듯,어떤 형세 가 빠르 고 성하
불 이 일 듯,어떤 형세 가 빠르 고 성하
불 꽃 튀,겨루 는 모양 이 치열 하
불 꽃 이 튀,겨루 는 모양 이 치열 하
불 아 내 ᆫ 놈 이 불이 야 하 ᆫ다,지은 죄 를 숨기 려고 하 ᆫ 짓 이 도리어 죄 를 드러내 고 말
불 똥 튀,재앙 이나 화 가 미치
불 똥 이 튀,재앙 이나 화 가 미치
불 똥 이 떨어지,꾸지람 을 듣 거나 벌 을 받
불 사 세 이 다,"토속 신앙 에서 , 조상 가운데 불사 가 되 ᆫ 사람 이 있 어서 자손 을 기르 기 에 힘 이 들 ㄴ다"
불사 가 세,"토속 신앙 에서 , 조상 가운데 불사 가 되 ᆫ 사람 이 있 어서 자손 을 기르 기 에 힘 이 들 ㄴ다"
불 을 끄,급하 ᆫ 일 을 처리 하
불 을 뿜,총구 에서 총 알 이 나가
불 을 토하,총구 에서 총 알 이 나가
불 이 나,뜻밖에 몹시 화 가 나 는 일 을 당하 여 감정 이 격렬 하 아 지
불 이 일 이 다,뜻밖에 몹시 화 가 나 는 일 을 당하 여 감정 이 격렬 하 아 지
불 집 을 건드리,말썽 이나 위험 을 스스로 불러들이
불 집 을 내,말썽 이나 위험 을 스스로 불러들이
불 집 을 일으키,말썽 을 일으키
불행 중 다행,불행 가운데 서 그나마 그만 하 면 다행
붓 을 꺾,글 을 쓰 는 문필 활동 에 관하 ᆫ 희망 을 버리 고 다른 일 을 하
붓 을 던지,글 을 쓰 는 문필 활동 에 관하 ᆫ 희망 을 버리 고 다른 일 을 하
붓 을 놓,글 을 매듭짓 고 그만 쓰
붓 을 대,글 이나 글씨 를 쓰
붓 을 들,문필 활동 을 시작 하
붓 이 가볍,짓 는 글 이 막히 지 않 고 순조 롭 게 잘 쓰 어 지
붓 이 나가,짓 는 글 이 순조 롭 게 되 어 가
비 묻,비 가 내리 ᆯ 수 있 는 눅눅 하 ᆫ 기운 을 품
비 가 묻,비 가 내리 ᆯ 수 있 는 눅눅 하 ᆫ 기운 을 품
비 가 오 나 눈 이 오,아무리 어려움 이 있 어도 언제나 한결같이
비교 도 되 지 않,어느 것 이 월등 하 게 뛰어나 아 다른 것 이 견주 ᆯ 만 하 ᆫ 가치 도 없
비단 방석 에 앉,매우 훌륭 하 고 보 람 있 는 지위 나 자리 를 차지 하
비단 보 를 씌우,속 은 보잘것없 는데 겉 만 아름답 게 보이 게 하
비단 보자기 를 씌우,속 은 보잘것없 는데 겉 만 아름답 게 보이 게 하
비린 내 나,정신 적 으로 나 육체 적 으로 성숙 하 지 못하 ᆫ 태도 나 기색 이 보이
비린 내 가 나,정신 적 으로 나 육체 적 으로 성숙 하 지 못하 ᆫ 태도 나 기색 이 보이
비 오,눈 물 이나 땀 따위 가 줄줄 많이 쏟아지
비위 사납,마음 에 거슬리 어 아니꼽
비위 가 사납,마음 에 거슬리 어 아니꼽
비위 상하,비위 가 좋 지 않 아 금방 게우 ᆯ 듯 하 여 지
비위 뒤집히,비위 가 좋 지 않 아 금방 게우 ᆯ 듯 하 여 지
비위 가 상하,비위 가 좋 지 않 아 금방 게우 ᆯ 듯 하 여 지
비위 가 뒤집히,비위 가 좋 지 않 아 금방 게우 ᆯ 듯 하 여 지
비위 뒤집,말 따위 로 아니꼽 게 하 거나 속 을 상하 게 하
비위 를 뒤집,말 따위 로 아니꼽 게 하 거나 속 을 상하 게 하
비위 쓰,비위 좋 게 도 아니꼽 고 싫 은 일 을 일부러 하
비위 를 쓰,비위 좋 게 도 아니꼽 고 싫 은 일 을 일부러 하
비위 팔,마음 에 거슬리 는 것 을 꾹 참
비위 를 팔,마음 에 거슬리 는 것 을 꾹 참
비점 을 찍,고르 ㅏ서 뽑
비하 ᆯ 바 없,차이 가 너무 크 어서 비기 ᆯ 데 가 없
비하 ᆯ 바 없이,차이 가 너무 크 어서 비기 ᆯ 데 가 없이
비행 기 태우,남 을 지나치 게 칭찬 하 거나 높이 추어올리 어 주
비행 기 를 태우,남 을 지나치 게 칭찬 하 거나 높이 추어올리 어 주
빈대 붙,남 에게 빌붙 어서 득 을 보
빈 손 으로 나앉,들이 ᆫ 노력 이 허사 로 되 어 아무것 도 얻 은 것 이 없이 하 던 일 에서 물러나
빈 손 털,가지 고 있 던 것 을 몽땅 털 어 내
빈 주먹 만 들,어떤 일 을 시작 하 ᆯ 때 에 아무것 도 가지 ᆫ 것 이 없
빗장 을 지르,마음 속 의 생각 을 남 에게 드러내 지 아니하 고 굳 게 감추
빙산 의 일각,대 부분 이 숨기 어 지 어 있 고 외부 로 나타나 아 있 는 것 은 극히 일 부분 에 지나 지 아니하
빙산 의 일각 一角,대 부분 이 숨기 어 지 어 있 고 외부 로 나타나 아 있 는 것 은 극히 일 부분 에 지나 지 아니하
빚 놓,여러 사람 에게 빚 을 주
빚 을 놓,여러 사람 에게 빚 을 주
빚 주,이자 를 받 기 로 하 고 돈 을 꾸 어 주
빚 을 주,이자 를 받 기 로 하 고 돈 을 꾸 어 주
빛 을 발하,저 의 능력 이나 값 어치 를 드러내
빛 을 보,업적 이나 보람 따위 가 드러나
빨갛 ᆫ 거짓 말,뻔히 드러나 ᆯ 만큼 터무니없 는 거짓 말
빨갛 ᆫ 상 놈,더 말 하 ᆯ 나위 없 는 상 놈
빳빳이 굶,먹 을 것 이 없 거나 먹 고 싶 지 않 아 아주 굶
빼 다 박,모양 이나 상황 따위 가 비슷 하
빼 다가 박,모양 이나 상황 따위 가 비슷 하
빼 도 박 도 못하,일 이 몹시 난처 하 게 되 어 그대로 하 ᆯ 수 도 그만두 ᆯ 수 도 없
뺑대 쑥 밭 이 되 었,집 터 따위 가 폐허 로 되 어 빈 터 만 남 았
뺑줄 치,남 의 물건 을 중간 에서 가로채
뺑줄 을 치,남 의 물건 을 중간 에서 가로채
뻘겋 ᆫ 거짓 말,뻔히 드러나 ᆯ 만큼 터무니없 는 거짓 말
뻘겋 ᆫ 상 놈,더 말 하 ᆯ 나위 없 는 상 놈
뼈 빠지 게,오랫 동안 육체 적 고통 을 견디 어 내 면서 힘겹 ᆫ 일 을 치르 어 나가
뼈 가 빠지 게,오랫 동안 육체 적 고통 을 견디 어 내 면서 힘겹 ᆫ 일 을 치르 어 나가
뼈 가 녹,어렵 거나 고되 ᆫ 일 로 고생 하
뼈 가 녹아나,어렵 거나 고되 ᆫ 일 로 고생 하
뼈 가 휘,오랫 동안 육체 적 고통 을 견디 어 내 면서 힘겹 ᆫ 일 을 치르 어 나가
뼈 다귀 녹이,마음 을 황홀 하 게 만들
뼈 다귀 를 녹이,마음 을 황홀 하 게 만들
뼈 대 있,심지 가 굳 고 줏 대 가 있
뼈 대 가 있,심지 가 굳 고 줏 대 가 있
뼈 대 가 굵 어 지,자라 서 성년 이 되
뼈 도 못 추리,죽 은 뒤 에 추리 ᆯ 뼈 조차 없 을 만큼 상대 와 싸움 의 적수 가 안 되 어 손실 만 보 고 전혀 남 는 것 이 없
뼈 를 긁어내,마음 속 의 고통 따위 가 몹시 심하
뼈 를 깎,몹시 견디 기 어렵 ᆯ 정도 로 고통 스럽
뼈 를 갈,몹시 견디 기 어렵 ᆯ 정도 로 고통 스럽
뼈 를 묻,단체 나 조직 에 평생토록 헌신 하
뼈 만 남,못 먹 거나 심하 게 앓 거나 하 여 지나치 게 여위
뼈 만 앙상 하,못 먹 거나 심하 게 앓 거나 하 여 지나치 게 여위
뼈 에 사무치,원한 이나 고통 따위 가 뼛 속 에 파고들 ᆯ 정도 로 깊 고 강 하
뼈 에 새기,가슴 에 새기
뼈 와 살 로 만들,"경험 , 사상 , 이론 따위 를 자기 의 확고 하 ᆫ 신념 으로 만들"
뼈 와 살 이 되,정신 적 으로 도움 이 되
뼛 골 빼,원기 가 탈진 하 여 힘 이 모두 없 어 지 게 하
뼛 골 을 빼,원기 가 탈진 하 여 힘 이 모두 없 어 지 게 하
뼛 골 빠지,육체 적 으로 매우 힘들 ᆫ 일 을 하 여 나가
뼛 골 이 빠지,육체 적 으로 매우 힘들 ᆫ 일 을 하 여 나가
뼛 골 아프,너무나 고통 스럽 어 뼛 속 까지 아프
뼛 골 이 아프,너무나 고통 스럽 어 뼛 속 까지 아프
뼛 골 에 사무치,뼈 에 사무치
뿌리 깊,어떤 일 이나 사물 의 연유 하 는 바 가 오래
뿌리 가 깊,어떤 일 이나 사물 의 연유 하 는 바 가 오래
뿌리 빠지,근원 까지 없 어 지 어 아무것 도 남 는 것 이 없 게 되
뿌리 가 빠지,근원 까지 없 어 지 어 아무것 도 남 는 것 이 없 게 되
뿌리 뽑,어떤 것 이 생겨나 고 자라 ᆯ 수 있 는 근원 을 없애 ㅓ 버리
뿌리 를 뽑,어떤 것 이 생겨나 고 자라 ᆯ 수 있 는 근원 을 없애 ㅓ 버리
뿌리 뽑히,어떤 것 이 생겨나 고 자라 ᆯ 수 있 는 근원 이 없 어 지
사개 맞,말 이나 사리 의 앞 뒤 관계 가 빈틈없이 딱 들어맞
사개 가 맞,말 이나 사리 의 앞 뒤 관계 가 빈틈없이 딱 들어맞
사관 트,사관 에 침 을 놓
사관 을 트,사관 에 침 을 놓
사납 은 암캐 같이 앙앙 하 ᆫ다,부녀 자 들 이 듣 기 싫 게 앙앙거리
사돈 의 팔촌,남 이나 다름없 는 멀 ᆫ 친척
사람 버리,좋 지 못하 ᆫ 사람 으로 되게 하 거나 사람 을 못 쓰 게 만들
사람 을 버리,좋 지 못하 ᆫ 사람 으로 되게 하 거나 사람 을 못 쓰 게 만들
사람 잡,사람 을 극심 하 ᆫ 곤경 에 몰아넣
사람 을 잡,사람 을 극심 하 ᆫ 곤경 에 몰아넣
사람 되,도덕 적 으로 나 인격 적 으로 사람 으로서 의 자질 을 갖추 ᆫ 인간 이 되
사람 이 되,도덕 적 으로 나 인격 적 으로 사람 으로서 의 자질 을 갖추 ᆫ 인간 이 되
사람 값 에 가,사람 으로 쳐주 ᆯ 만 하 ᆫ 가치 를 지니
사람 값 에 들,사람 이 라고 이 를 만하 ㄴ 가치 를 지니
사람 값 에 들 지 못하,사람 으로 쳐주 ᆯ 만 하 ᆫ 가치 에서 크 게 벗어나
사람 같 지 않,사람 으로서 마땅히 지니 어야 하 ᆯ 품행 이나 덕성 이 없
사람 살리 어,생명 에 위험 을 느끼 ᆯ 만큼 위급 하 ᆫ 상황 에 처하 았 을 때 외치 는 소리
사람 죽이,너무 힘겹 ᆫ 경우 를 당하 여 매우 힘들 고 고달프
사랑 을 속삭이,이성 간 에 사랑 의 말 을 주고받
사랑 의 보금 자리,서로 사랑 하 는 사람 끼리 만드 는 새 가정
사 를 보,일 처리 에서 어떤 사람 에게 이롭 도록 안면 을 보 거나 정실 에 흐르
사 를 두,일 처리 에서 어떤 사람 에게 이롭 도록 안면 을 보 거나 정실 에 흐르
사 를 쓰,일 처리 에서 공정 하 지 못하 게 안면 이나 정실 관계 를 이용 하
사색 없,태연 하 여 말 과 얼굴 빛 에 변하 ᄆ 이 없
사색 이 없,태연 하 여 말 과 얼굴 빛 에 변하 ᄆ 이 없
사 서 고생 하,고생 하 지 아니하 여도 되 ᆯ 일 을 저 의 스스로 만들 어 고생 하
사 서 고생 을 하,고생 하 지 아니하 여도 되 ᆯ 일 을 저 의 스스로 만들 어 고생 하
사성 보내,혼담 이 결정 되 어 사주 단자 를 적 어 보내
사성 을 보내,혼담 이 결정 되 어 사주 단자 를 적 어 보내
사성 가,혼담 이 결정 되 어 사주 단자 를 가지 고 가
사성 이 가,혼담 이 결정 되 어 사주 단자 를 가지 고 가
사성 오,혼담 이 결정 되 어 사주 단자 가 오
사성 이 오,혼담 이 결정 되 어 사주 단자 가 오
사시 나무 떨 ᆯ 듯,몸 을 몹시 떨
사이 뜨,사람 사이 의 관계 가 친밀 하 지 않 거나 벌어지
사이 가 뜨,사람 사이 의 관계 가 친밀 하 지 않 거나 벌어지
사정 두,남 의 형편 을 헤아리 어 생각 하
사정 을 두,남 의 형편 을 헤아리 어 생각 하
사족 못 쓰,무슨 일 에 반하 거나 혹하 여 꼼짝 못 하
사족 을 못 쓰,무슨 일 에 반하 거나 혹하 여 꼼짝 못 하
사 주 세,타고나 ᆫ 나쁘 ᆫ 운수 때문 에 살아가 는 데 에 파란 곡절 이 많
사주 가 세,타고나 ᆫ 나쁘 ᆫ 운수 때문 에 살아가 는 데 에 파란 곡절 이 많
사지 를 못 쓰,무슨 일 에 반하 거나 혹하 여 꼼짝 못 하
사지 를 펴,근심 이나 걱정 없이 마음 을 놓
사춤 치,담 이나 벽 따위 의 벌어지 ᆫ 틈 을 진 흙 따위 로 메우
사춤 을 치,담 이나 벽 따위 의 벌어지 ᆫ 틈 을 진 흙 따위 로 메우
사타구니 를 긁,알랑거리 며 남 에게 아첨 하
사흘 이 멀 다 하 고,일 의 횟수 가 매우 잦 게
삯 내,세 를 내
삯 을 내,세 를 내
