idiom,meaning
아프 ᆫ 데 를 건드리,상대 방 의 약점 이나 허점 을 말 하 거나 지적 하
아프 ᆫ 곳 을 찌르,상대 방 의 약점 이나 허점 을 말 하 거나 지적 하
악다구니 를 놀리,기 를 쓰 고 욕설 을 하
악 머구리 끓,많 은 사람 이 모이 어서 시끄럽 게 마구 떠드 는 모양
악사 를 먹이,일 이 제대로 안 되 고 문제 가 생기 어 애 를 먹이
악업 의 맹화,악업 이 보리 심 을 잃 게 하 는 일 을 맹화 가 초목 을 불사르 는 것 에 비유 하 여 이르 는 말
악업 의 맹화 猛火,악업 이 보리 심 을 잃 게 하 는 일 을 맹화 가 초목 을 불사르 는 것 에 비유 하 여 이르 는 말
악지 빼,체벌 을 가하 여 악지 스럽 ᆫ 마음 을 뽑 아 버리
악지 를 빼,체벌 을 가하 여 악지 스럽 ᆫ 마음 을 뽑 아 버리
안개 를 피우,어떤 사실 을 숨기 기 위하 아 교묘 하 ᆫ 수단 을 쓰
안개 속 에 묻히,어떤 사실 이나 비밀 이 밝히 어 지 지 않
안개 에 싸이,어떤 사실 이나 비밀 이 밝히 어 지 지 않
안경 쓰,있 는 그대로 보 지 않 고 선입 견 을 가지
안경 을 쓰,있 는 그대로 보 지 않 고 선입 견 을 가지
안 고 돌,번잡 하 게 꼬리 를 물 고 붐비
안 고 돌아가,맡 은 일 을 제대로 하 지 못하 고 질질 끌
안면 바꾸,잘 알 고 지내 던 사람 을 일부러 모르 ᆫ 체하
안면 을 바꾸,잘 알 고 지내 던 사람 을 일부러 모르 ᆫ 체하
안색 낮추,흥분 을 누르 며 침착 하 고 공손 하 게 대하
안색 을 낮추,흥분 을 누르 며 침착 하 고 공손 하 게 대하
안 으로 들어가,실 속 있 게 내용 을 파고들
안팎 으로 꼭 맞,여러 가지 점 으로 완전히 맞 거나 서로 어울리
앉 아 기다리,다른 사람 이 하 아 주 ᆯ 것 만 바라 고 전혀 노력 하 지 아니하
앉 아서 기다리,다른 사람 이 하 아 주 ᆯ 것 만 바라 고 전혀 노력 하 지 아니하
앉 아 뭉개,일 을 제대로 하 지 못하 고 우물쭈물 하
앉 아서 뭉개,일 을 제대로 하 지 못하 고 우물쭈물 하
앉 아 배기,그 자리 에서 어렵 ᆫ 일 을 감당 하 아 내
앉 아서 배기,그 자리 에서 어렵 ᆫ 일 을 감당 하 아 내
앉 아서 벼락 맞,가만히 있 다가 뜻 밖 의 화 를 당하
앉 으나 서,언제나
알 까,잡 았 던 공 을 놓치
알 을 까,잡 았 던 공 을 놓치
알 게 모르 게,자신 도 모르 는 사이 에
알 게 뭐 이 야,어떻게 되 든 상관 이 없
알 게 뭐 나,어떻게 되 든 상관 이 없
알 게 뭐 이 ㅔ요,어떻게 되 든 상관 이 없
알 게 뭐 이 ᄇ니까,어떻게 되 든 상관 이 없
알 다가 도 모르,어떤 일 이 선뜻 이해 가 가 지 않
알랑 방귀 뀌,알랑거리 며 아첨 을 떨
알랑 방귀 를 뀌,알랑거리 며 아첨 을 떨
앓 는 소리,일부러 구실 을 대 며 걱정 하 는 모양
암상 이 돋치,몹시 암상 스럽 ᆫ 기색 이 나타나
앞 못 보,눈 이 멀 어서 보 지 못하
앞 을 못 보,눈 이 멀 어서 보 지 못하
앞 길 이 멀,앞 으로 하 아야 하 ᆯ 일 들 이 많이 남 아 있
앞 뒤 가리 지 않,신중히 이것 저것 생각 하 지 아니하 고 마구 행동 하
앞 뒤 를 가리 지 않,신중히 이것 저것 생각 하 지 아니하 고 마구 행동 하
앞 뒤 가 다르,말 이나 행동 이 서로 맞 지 않
앞 뒤 가 막히,융통 성 이 없 고 답답 하
앞 뒤 가 맞,이야기 따위 가 이치 에 맞 고 조리 가 있
앞 뒤 걸음 을 재,행동 을 이모 저모 로 계산 하
앞 뒤 를 재,어떤 일 을 하 ᆯ 때 자신 의 이해 나 득실 을 신중 하 게 따지 고 이것 저것 계산 하
앞 뒤 를 가리,어떤 일 을 하 ᆯ 때 자신 의 이해 나 득실 을 신중 하 게 따지 고 이것 저것 계산 하
앞 뒤 를 헤아리,어떤 일 을 하 ᆯ 때 자신 의 이해 나 득실 을 신중 하 게 따지 고 이것 저것 계산 하
앞 방석 을 차지 하,비서 의 역할 을 하
앞서 거니 뒤서,같 은 방향 으로 나가 면서 서로 앞 에 서 기 도 하 고 뒤 에 서 기 도 하
앞 에 내세우,다른 것 보다 더 두드러지 게 드러내 어 놓 거나 중요시 하
앞 을 닦,자기 하 ᆯ 일 을 잘 하 고 행동 을 바르 게 하
앞 이 벌,담당 하 거나 감당 하 기 가 힘 에 겹
앞 자락 이 넓,관심 을 가지 는 분야 가 매우 넓
애 마르,몹시 안타깝 고 초조 하 여 속 이 상하
애 가 마르,몹시 안타깝 고 초조 하 여 속 이 상하
애 말리,남 을 안타깝 고 속 이 상하 게 만들
애 를 말리,남 을 안타깝 고 속 이 상하 게 만들
애 가 쓰이,안타깝 ᆫ 마음 이 쓰이
애 간장 말리,남 을 안타깝 고 속 이 상하 게 만들
애 간장 을 말리,남 을 안타깝 고 속 이 상하 게 만들
애 간장 태우,몹시 초조 하 고 안타깝 어서 속 을 많이 태우
애 간장 을 태우,몹시 초조 하 고 안타깝 어서 속 을 많이 태우
애 간장 녹,몹시 애 가 타
애 간장 이 녹,몹시 애 가 타
애 간장 마르,몹시 안타깝 고 초조 하 여 속 이 상하
애 간장 이 마르,몹시 안타깝 고 초조 하 여 속 이 상하
애 간장 을 녹이,상대 편 의 환심 을 사
앵 두 따다,눈 물 을 뚝뚝 흘리 며 울
앵두 를 따,눈 물 을 뚝뚝 흘리 며 울
야단 을 때리,아주 크 게 꾸짖
야비 다리 치,교만 하 ᆫ 사람 이 일부러 겸손 하 ᆫ 체하
야비 다리 를 치,교만 하 ᆫ 사람 이 일부러 겸손 하 ᆫ 체하
약 올리,비위 가 상하 여 언짢 거나 은근히 화 가 나 게 하
약 을 올리,비위 가 상하 여 언짢 거나 은근히 화 가 나 게 하
약 지르,약품 을 넣
약 을 지르,약품 을 넣
약 팔,이것 저것 끌어대 어 입 담 좋 게 이야기 를 늘어놓
약 을 팔,이것 저것 끌어대 어 입 담 좋 게 이야기 를 늘어놓
약 오르,비위 가 상하 여 언짢 거나 은근히 화 가 나
약 이 오르,비위 가 상하 여 언짢 거나 은근히 화 가 나
약물 맞,병 을 예방 하 거나 고치 기 위하 여 약수 터 에 가 서 약물 을 먹 거나 몸 을 씻
약물 을 맞,병 을 예방 하 거나 고치 기 위하 여 약수 터 에 가 서 약물 을 먹 거나 몸 을 씻
약 을 걸,약국 을 차리
약 을 치,뇌물 을 주
약효 가 떨어지,뇌물 의 효력 이 없 어 지
약효 를 잃,뇌물 의 효력 이 없 어 지
얌생이 몰,남 의 물건 을 조금 씩 슬쩍슬쩍 훔치 어 내
얌생이 치,남 의 물건 을 조금 씩 슬쩍슬쩍 훔치 어 내
얌치 빠지,더 하 ᆯ 나위 없이 체면 도 부끄러움 도 없
얌치 가 빠지,더 하 ᆯ 나위 없이 체면 도 부끄러움 도 없
양 가죽 을 쓰,흉악 하 ᆫ 본성 을 숨기 기 위하 여 겉 으로 순하 고 착하 ᆫ 것 처럼 꾸미
양 귀비 외 딴 치,여자 의 용모 가 아주 아름답
양 다리 걸치,양 쪽 에서 이익 을 보 려고 두 편 에 다 관계 를 가지
양 다리 걸,양 쪽 에서 이익 을 보 려고 두 편 에 다 관계 를 가지
양 다리 를 걸치,양 쪽 에서 이익 을 보 려고 두 편 에 다 관계 를 가지
양 다리 를 걸,양 쪽 에서 이익 을 보 려고 두 편 에 다 관계 를 가지
양자 가,양자 로 작정 되 어 양가 에 가
양자 로 가,양자 로 작정 되 어 양가 에 가
양자 들,남 의 집 의 양자 가 되
양자 를 들,남 의 집 의 양자 가 되
양자 들 이,입양 하
양자 를 들이,입양 하
양자 세우,양자 를 작정 하 여 들이 어 세우
양자 를 세우,양자 를 작정 하 여 들이 어 세우
어금 니 를 악물,고통 이나 분노 따위 를 참으 려고 이 를 악물 어 굳 은 의지 를 나타내
어깨 견주,서로 비슷 하 ᆫ 지위 나 힘 을 가지
어깨 를 견주,서로 비슷 하 ᆫ 지위 나 힘 을 가지
어깨 가 으쓱거리,뽐내 고 싶 은 기분 이나 떳떳 하 고 자랑 스럽 ᆫ 기분 이 되
어깨 를 으쓱거리,뽐내 고 싶 은 기분 이나 떳떳 하 고 자랑 스럽 ᆫ 기분 이 되
어깨 가 가볍,무겁 ᆫ 책임 에서 벗어나 거나 그 책임 을 덜 어 마음 이 홀가분 하
어깨 가 무겁,무겁 ᆫ 책임 을 지 어서 마음 에 부담 이 크
어깨 가 올라가,칭찬 을 받 거나 하 여 기분 이 으쓱 하 아 지
어깨 가 움츠러들,떳떳 하 지 못하 거나 창피 하 고 부끄럽 ᆫ 기분 을 느끼
어깨 가 처지,낙심 하 여 풀 이 죽 고 기 가 꺾이
어깨 가 낮 아 지,낙심 하 여 풀 이 죽 고 기 가 꺾이
어깨 가 늘어지,낙심 하 여 풀 이 죽 고 기 가 꺾이
어깨 로 숨 을 쉬,어깨 를 들먹이 며 괴롭 ᆫ 듯이 숨 을 쉬
어깨 를 같이 하,같 은 목적 으로 함께 일 하
어깨 를 겨누,서로 비슷 하 ᆫ 지위 나 힘 을 가지
어깨 를 겨루,서로 비슷 하 ᆫ 지위 나 힘 을 가지
어깨 를 겯,같 은 목적 을 위하 여 행동 을 서로 같이 하
어깨 를 나란히 하,서로 비슷 하 ᆫ 지위 나 힘 을 가지
어깨 를 낮추,겸손 하 게 자기 를 낮추
어깨 를 들이밀,어떤 일 에 몸 을 아끼 지 아니하 고 뛰어들
어깨 를 들이대,어떤 일 에 몸 을 아끼 지 아니하 고 뛰어들
어깨 를 짓누르,"의무 나 책임 , 제약 따위 가 중압 감 을 주"
어깨 를 펴,굽히 ᆯ 것 이 없이 당당 하
어깨 에 걸머지,무겁 ᆫ 책임 따위 를 맡 게 되
어깨 에 지,어떤 일 에 대하 ᆫ 책임 이나 의무 를 마음 에 두
어깨 에 짊어지,어떤 일 에 대하 ᆫ 책임 이나 의무 를 마음 에 두
어깨 에 힘 주,거만 하 ᆫ 태도 를 취하
어깨 에 힘 을 주,거만 하 ᆫ 태도 를 취하
어깨 에 힘 이 들어가,거만 하 ᆫ 태도 를 취하 게 되
어깻 죽지 가 처지,풀 이 죽 고 기 가 꺾이
어느 겨를 에,어느 사이 나 여가 에
어느 겨를 에,어느 사이 나 여가 에
어느 겨를 에,어느 사이 나 여가 에
어느 겨를 에,어느 사이 나 여가 에
어느 때 이 고,어느 때 이 라고 가리 ᆯ 것 없이
어느 세월 에,얼마나 뒤 에
어느 세월 에,얼마나 뒤 에
어디 이 라 없이,빠지 ᆫ 곳 이 없이 모두
어디 를 막론 하 고,어디 를 가리 ᆯ 것 없이 어느 곳 이 나
어디 에다 대 고,누구 에게 향하
어렵 ᆫ 걸음 하,일 이 바쁘 거나 너무 멀 어서 좀처럼 가 기 힘들 ᆫ 곳 을 가 거나 오
어렵 ᆫ 걸음 을 하,일 이 바쁘 거나 너무 멀 어서 좀처럼 가 기 힘들 ᆫ 곳 을 가 거나 오
어른 뺨치,아이 가 어른 도 못 당하 ᆯ 만큼 영악 하
어린이 장난 같,아이 들 의 장난 같이 가소 롭
어림 반 푼 어치 도 없,몹시 부당 하 거나 터무니없
어복 에 장사 지내,물 에 빠지 어 죽
어복 포 되,아주 수 가 나
어복 포 가 되,아주 수 가 나
어 살 지르,어 살 을 물 속 에 세우
어 살 을 지르,어 살 을 물 속 에 세우
어안 이 막히,뜻밖에 놀랍 거나 이상 하 ᆫ 일 을 당하 아 이 기 가 막히
어안 이 벙벙 하,뜻밖에 놀랍 거나 기막히 ᆫ 일 을 당하 여 어리둥절 하
어제 다르 고 오늘 다르,변화 하 는 속도 가 매우 빠르
어제 가 다르 고 오늘 이 다르,변화 하 는 속도 가 매우 빠르
어제 가 옛 날,변화 가 매우 빠르 아서 짧 은 시간 사이 의 변화 가 아주 크
어제 가 옛 날 이,변화 가 매우 빠르 아서 짧 은 시간 사이 의 변화 가 아주 크
어제 오늘 하 ᆯ 것 없,날 짜 를 가리 거나 따지 ᆯ 것 없
어제 오늘 하 ᆯ 것 없이,날 짜 를 가리 거나 따지 ᆯ 것 없이
어제 와 오늘 이 다르,하루 사이 에 차이 가 생기 어서 같 지 아니하
어진 혼 나가,몹시 놀라 거나 시끄럽 어서 맑 은 정신 을 잃
어진 혼 빠지,몹시 놀라 거나 시끄럽 어서 맑 은 정신 을 잃
어진 혼 이 나가,몹시 놀라 거나 시끄럽 어서 맑 은 정신 을 잃
어진 혼 이 빠지,몹시 놀라 거나 시끄럽 어서 맑 은 정신 을 잃
억장 이 무너지,극심 하 ᆫ 슬픔 이나 절망 따위 로 몹시 가슴 이 아프 고 괴롭
억지 춘향,억지로 어떤 일 을 이루 게 하 거나 어떤 일 이 억지로 겨우 이루어지 는 경우 를 비유 적 으로 이르 는 말
억지 춘향 이,억지로 어떤 일 을 이루 게 하 거나 어떤 일 이 억지로 겨우 이루어지 는 경우 를 비유 적 으로 이르 는 말
언질 잡,남 이 한 말 을 자기 가 하 ᆯ 말 의 증거 로 삼
언질 을 잡,남 이 한 말 을 자기 가 하 ᆯ 말 의 증거 로 삼
언질 주,어떤 일 이나 현상 따위 의 결과 를 예측 하 ᆯ 수 있 는 단서 를 제공 하
언질 을 주,어떤 일 이나 현상 따위 의 결과 를 예측 하 ᆯ 수 있 는 단서 를 제공 하
언필칭 요순,항상 성현 의 말 을 들추 어 고고 하 ᆫ 체 하
얻어들 은 풍월,정식 으로 배우 ᆫ 것 이 아니 라 남 에게 들 어서 아 는 지식
얼 먹,놀라 서 어리둥절 하 여 지
얼 을 먹,놀라 서 어리둥절 하 여 지
얼 나가,정신 이 나가 아 어리둥절 하 여 지
얼 이 나가,정신 이 나가 아 어리둥절 하 여 지
얼 치,정신 을 잃 어 버리
얼 이 치,정신 을 잃 어 버리
얼굴 가죽 이 두껍,부끄러움 을 모르 고 염치 가 없
얼굴 만 쳐다보,남 의 도움 을 기대 하 고 눈 치 를 보 거나 비위 를 맞추
얼굴 빛 을 바로잡,얼굴 에 엄정 하 ᆫ 빛 이나 표정 을 나타내
얼굴 에 씌 어 있,"감정 , 기분 따위 가 얼굴 에 나타나"
얼굴 에 외 꽃 이 피,얼굴 이 누렇 게 뜨 어 병색 이 짙
얼굴 을 고치,화장 을 다시 하
얼굴 을 내밀,모임 따위 에 모습 을 나타내
얼굴 을 내놓,모임 따위 에 모습 을 나타내
얼굴 을 비치,모임 따위 에 모습 을 나타내
얼굴 을 들,남 을 떳떳이 대하
얼굴 을 보,체면 을 고려 하
얼굴 이 꽹과리 같,사람 이 염치 가 없 고 뻔뻔 스럽
얼굴 이 넓,사귀 어 아 는 사람 이 많
얼굴 이 두껍,부끄러움 을 모르 고 염치 가 없
얼굴 이 선지 방구리 가 되,몹시 흥분 하 여 얼굴 이 시뻘겋 게 되
얼마 상관 아니,차이 가 얼마 나 지 아니하
얼 바람 맞,어중간 하 게 바람 을 맞 은 것 처럼 실없이 허튼 짓 을 하
얼 바람 을 맞,어중간 하 게 바람 을 맞 은 것 처럼 실없이 허튼 짓 을 하
얼 어 죽 을,전혀 합당 하 지 아니하 ᆫ
얼 을 먹,남 의 잘못 때문 에 해 를 당하
얼 을 쓰,남 의 잘못 때문 에 해 를 당하
얼 을 입,남 의 잘못 때문 에 해 를 당하
엄지 손 가락 으로 치,여럿 가운데 제일 로 여기
업 어 가 도 모르,잠 이 깊이 들 어 웬만 하 ᆫ 소리 나 일 에 는 깨어나 지 아니하 는 상태 이
없 는 것 이 없,모든 것 이 다 갖추 어 지 어 있
엉덩이 가 가볍,어느 한 자리 에 오래 머물 지 못하 고 바로 자리 를 뜨
엉덩이 가 구리,부정 이나 잘못 을 저지르 ᆫ 것 같
엉덩이 가 근질근질 하,한 군데 가만히 앉 아 있 지 못하 고 자꾸 일어나 아 움직이 고 싶 어 하
엉덩이 가 무겁,한 번 자리 를 잡 고 앉 으면 좀처럼 일어나 지 아니하
엉덩이 가 질기,한 번 자리 를 잡 고 앉 으면 좀처럼 일어나 지 아니하
엉덩이 를 붙이,자리 를 잡 고 앉
엎 더 지며 곱 더 지며,연하 여 엎드러지 면서 달아나 는 모양 을 비유 적 으로 이르 는 말
엎드러지 며 곱 어 들 러 지,급히 뛰어가 느라고 앞 으로 잇따르 아 엎드러지
엎지르 ᆫ 물,다시 바로잡 거나 되돌리 ᆯ 수 없 는 일 을 비유 적 으로 이르 는 말
엎치 고 덮치,어렵 거나 나쁘 ᆫ 일 이 겹치 어 일어나
엎치 나 뒤치,이렇게 하나 저렇게 하나 결과 는 마찬가지 이 라는 말
엎치 나 덮치,이렇게 하나 저렇게 하나 결과 는 마찬가지 이 라는 말
엎치 나 메치,이렇게 하나 저렇게 하나 결과 는 마찬가지 이 라는 말
엎치 ᆫ 데 덮치,어렵 거나 나쁘 ᆫ 일 이 겹치 어 일어나
여간 아니,보통 이 아니 고 대단 하
여간 이 아니,보통 이 아니 고 대단 하
여느 때 없,보통 때 와 는 다르
여느 때 없이,보통 때 와 는 다르 게
역사 의 한 페이지 를 장식 하,중요 하 ᆫ 일 로 기념 하 거나 기록 하
연막 치,어떤 수단 을 쓰 어서 교묘 하 게 진의 를 숨기
연막 을 치,어떤 수단 을 쓰 어서 교묘 하 게 진의 를 숨기
연 밥 먹이,살살 구슬리 어 꼬드기
연 밥 을 먹이,살살 구슬리 어 꼬드기
연안 은 짐 독 이,헛되이 놀 고 즐기 는 것 은 독약 과 같이 사람 을 해치 ᆫ다
열 올리,흥분 하
열 내,흥분 하
열 을 올리,흥분 하
열 을 내,흥분 하
열 오르,흥분 하
열 이 오르,흥분 하
열 고 보 나 닫 고 보,이렇게 하나 저렇게 하나 마찬가지 이 다
열매 맺,노력 하 ᆫ 일 의 성과 가 나타나
열매 를 맺,노력 하 ᆫ 일 의 성과 가 나타나
열 번 죽 었 다 깨 어도,온갖 노력 을 다 하 여도
열 번 죽 었 다 살,온갖 노력 을 다 하 여도
열 번 죽 었 다 피 어도,온갖 노력 을 다 하 여도
열 에 뜨,몹시 흥분 하 거나 성 이 나
열 에 받치,몹시 흥분 하 거나 격분 하
열 에 아홉,거의 모두
열 이 오르 았 다 내리 었 다 하,일정 하 ᆫ 수준 에서 꾸준 하 게 있 지 못하
열 일 제치,한 가지 중요 하 ᆫ 일 때문 에 다른 모든 일 은 뒤 로 미루 거나 그만두
염병 을 떨,엉뚱 하 거나 나쁘 ᆫ 짓 을 하
염불 외 듯,알아듣 지 못하 ᆯ 소리 로 중얼거리 는 듯
염치 차리,염치 를 알 아 부끄럽 지 아니하 게 행동 하
염치 를 차리,염치 를 알 아 부끄럽 지 아니하 게 행동 하
염통 에 바람 들,마음 이 들뜨 어서 제대로 행동 하 지 못하
염통 에 털 이 나,체면 도 없이 아주 뻔뻔 하
염통 이 비뚤 어 앉,마음 이 비꼬이
엿 가락 늘이,점잔 을 빼 고 오래 기다리
엿 가락 을 늘이,점잔 을 빼 고 오래 기다리
엿 기름 을 넣,남 의 것 을 자기 것 처럼 감추
엿 먹이,슬쩍 골리 어 주 거나 속이
엿 물 을 흘리 었,곤란 을 많이 겪 었
엿 장수 마음대로,자기 마음대로 이러 었 다가 저러 었 다가 하
엿 장수 맘대로,자기 마음대로 이러 었 다가 저러 었 다가 하
영각 쓰,황 소 가 암 소 를 부르 느라고 크 게 울 음 소리 를 내
영각 켜,황 소 가 암 소 를 부르 느라고 크 게 울 음 소리 를 내
영각 을 쓰,황 소 가 암 소 를 부르 느라고 크 게 울 음 소리 를 내
영각 을 켜,황 소 가 암 소 를 부르 느라고 크 게 울 음 소리 를 내
영별 짓,죽 어서 영원히 이별 하
영별 을 짓,죽 어서 영원히 이별 하
옆 으로 빠지,어떤 일 을 피하 여 몸 을 사리 거나 딴 데 로 나가
옆 으로 제치 어 놓,관심 의 대상 으로 삼 지 않
옛 꿈 을 꾸,예전 의 처지 나 지위 따위 를 되찾 아 보 려는 헛되 고 어리석 은 생각 을 하
옛 날 옛 적 에,매우 오래 전 에
오갈 들,두려움 에 기운 을 펴 지 못하
오갈 이 들,두려움 에 기운 을 펴 지 못하
오가 ᆯ 데 가 없,사 ᆯ 집 이 없
오강 사공 의 닻 줄 감 듯,무엇 을 능숙 하 게 하
오금 박,다른 사람 에게 함부로 말 이나 행동 을 하 지 못하 게 단단히 이르 거나 으르
오금 을 박,다른 사람 에게 함부로 말 이나 행동 을 하 지 못하 게 단단히 이르 거나 으르
오금 뜨,마음 이 방탕 하 여 놀아나
오금 이 뜨,마음 이 방탕 하 여 놀아나
오금 박히,다른 사람 으로부터 함부로 말 이나 행동 을 하 지 못하 게 단단히 이름 을 받 거나 으름 을 당하
오금 이 박히,다른 사람 으로부터 함부로 말 이나 행동 을 하 지 못하 게 단단히 이름 을 받 거나 으름 을 당하
오금 아 나 ᆯ 살리 어라,있 는 힘 을 다 하 여 매우 다급 하 게 도망치
오금 에 바람 들,침착 하 게 한 곳 에 있 지 못하 고 들뜨 어서 마구 설치
오금 에 돌개 바람 들,침착 하 게 한 곳 에 있 지 못하 고 들뜨 어서 마구 설치
오금 에 바람 차 이 다,침착 하 게 한 곳 에 있 지 못하 고 들뜨 어서 마구 설치
오금 에 바람 이 들,침착 하 게 한 곳 에 있 지 못하 고 들뜨 어서 마구 설치
오금 에 바람 이 들,침착 하 게 한 곳 에 있 지 못하 고 들뜨 어서 마구 설치
오금 에 바람 이 차,침착 하 게 한 곳 에 있 지 못하 고 들뜨 어서 마구 설치
오금 에서 불 이 나 게,무엇 이 ᆫ가 를 찾 거나 구하 려고 무척 바쁘 게 돌아다니
오금 을 떼,걸음 을 옮기
오금 을 못 쓰,몹시 마음 이 끌리 거나 두렵 어 꼼짝 못 하
오금 을 못 추,몹시 마음 이 끌리 거나 두렵 어 꼼짝 못 하
오금 을 못 펴,몹시 마음 이 끌리 거나 두렵 어 꼼짝 못 하
오금 을 펴,마음 을 놓 고 여유 있 게 지내
오금 이 굳,꼼짝 을 못 하 게 되
오금 이 묶이,일 에 매이 어서 꼼짝 못 하 게 되
오금 이 밀리,마음 이 방탕 하 여 놀아나
오금 이 붙,팔 다리 가 잘 움직이 지 아니하
오금 이 얼어붙,팔 다리 가 잘 움직이 지 아니하
오금 이 쑤시,무슨 일 을 하 고 싶 어 가만히 있 지 못하
오금 이 저리,저지르 ᆫ 잘못 이 들통 이 나 거나 그 때문 에 나쁘 ᆫ 결과 가 있 지 않 을까 마음 을 졸이
오 너라 가 거라 하,어떤 사람 이 다른 사람 을 성가시 게 오가 게 하
오뉴 월 써렛 발 같,사물 이 드문드문 하 게 있
오뉴 월 엿 가락,행동 이나 말 이 느리 거나 길 게 늘어지 ᆫ 모양
오 도 가 도 못하,한 곳 에서 자리 를 옮기 거나 움직이 ᆯ 수 없 는 상태 가 되
오 라 가 라 하,어떤 사람 이 다른 사람 을 성가시 게 오가 게 하
오 장 긁,남 의 비위 를 건드리
오 장 을 긁,남 의 비위 를 건드리
오 장 찢기,심하 ᆫ 마음 의 고통 을 받
오 장 찢어지,심하 ᆫ 마음 의 고통 을 받
오장 이 찢기,심하 ᆫ 마음 의 고통 을 받
오장 이 찢어지,심하 ᆫ 마음 의 고통 을 받
오장 육부 가 뒤바뀌,마음 이 변하
오 장 을 뒤집,남 의 비위 를 건드리
오장 이 뒤집히,분통 이 터지 어서 견디 ᆯ 수 가 없
오장 이 바뀌,마음 이 변하
오쟁이 지,자기 의 아내 가 다른 남자 와 간 통하
오쟁이 를 지,자기 의 아내 가 다른 남자 와 간 통하
오점 을 찍,불 명예 스럽 ᆫ 흠 집 을 만들
오지랖 넓,쓸데없이 지나치 게 아무 일 에 나 참견 하 는 면 이 있
오지랖 이 넓,쓸데없이 지나치 게 아무 일 에 나 참견 하 는 면 이 있
옥반 에 진주 굴 ᆯ 듯,목 소리 가 매우 청아 하 고 아름답
옥반 에 진주 구르,목 소리 가 매우 청아 하 고 아름답
옥 밥 먹,감옥 에 갇히 어 지내 는 생활 을 하
옥 밥 을 먹,감옥 에 갇히 어 지내 는 생활 을 하
오 ᆫ다 가 ᆫ다 말없이,자기 거취 에 대하 여서 아무 에게 도 말 하 지 아니하 고 슬그머니
온 세상 을 얻 은 듯,매우 만족 하 아 하
온실 속 에서 자라 ᆫ 화초,어려움 이나 고난 을 겪 지 아니하 고 그저 곱 게 만 자라 ᆫ 사람
온실 속 의 화초,어려움 이나 고난 을 겪 지 아니하 고 그저 곱 게 만 자라 ᆫ 사람
올 되,거만 하 고 고집 이 세
올 이 되,거만 하 고 고집 이 세
올가미 쓰,남 의 꾀 에 걸려들
올가미 를 쓰,남 의 꾀 에 걸려들
올가미 씌우,계략 을 쓰 어서 남 을 걸려들 게 하
올가미 를 씌우,계략 을 쓰 어서 남 을 걸려들 게 하
오 ᆯ 것 이 오,좋 지 않 은 일 이 예상 대로 당연 하 게 일어나
올빼미 눈 같,낮 보다 밤 에 더 잘 보
옴치 고 뛰 ᆯ 수 없,어쩌 ᆯ 도리 가 없 게 되
옷 깃 을 여미,경건 하 ᆫ 마음 으로 옷 을 가지런 하 게 하 여 자세 를 바로잡
옹 이 지,마음 에 언짢 은 감정 이 있
옹 이 가 아 지,마음 에 언짢 은 감정 이 있
옻 올리,옻 이 오르 아 살 갗 이 헐 어 부스럼 이 돋 아시
옻 을 올리,옻 이 오르 아 살 갗 이 헐 어 부스럼 이 돋 아시
오 았 다 가 았 다 하,정신 이 맑 았 다 흐리 었 다 하
왕기 뜨이,행복 스럽 게 되 ᆯ 조짐 이 보이
왕기 가 뜨이 다 01,행복 스럽 게 되 ᆯ 조짐 이 보이
왕기 뜨이,임금 이 나 ᆯ 조짐 이나 임금 이 되 ᆯ 조짐 이 보이
왕기 가 뜨이 다 02,임금 이 나 ᆯ 조짐 이나 임금 이 되 ᆯ 조짐 이 보이
외곽 을 때리,우회 적 으로 상대 방 에게 해 를 끼치
외국 물 을 먹,외국 에서 생활 을 하
외로 지나 바로 지,이렇게 하나 저렇게 하나 마찬가지 이 다
외로 틀,일 이나 의견 따위 에 동의 하 지 아니하 고 어긋나 아 가
왼 고개 를 치,부정 이나 반대 의 뜻 을 나타내
왼 고개 를 틀,무엇 이 못 마땅 하 여 바로 보 지 아니하 고 외면 하
왼 새끼 꼬,일 이 꼬이 어 어떻게 되 ᆯ지 모르 아 애 를 태우
왼 새끼 를 꼬,일 이 꼬이 어 어떻게 되 ᆯ지 모르 아 애 를 태우
요 모양 이 오 꼴,좋 지 않 은 처지 나 형편
요원 의 불 길,무섭 ᆫ 기세 로 퍼지 어 가
욕심 사납,몹시 욕심 이 많
