idiom,meaning
독선 을 잡,배 를 혼자 서 세 를 주 고 빌리 거나 차지 하
독 선생 을 앉히,집 에 독 선생 을 두
독 안 에 들 ᆫ 쥐,궁지 에서 벗어나 ᆯ 수 없 는 처지
독 안 에 들,이미 잡히 ᆫ 것 이나 다름없
돈 굴리,돈 을 여기 저기 빌리 어 주 어 이익 을 늘리
돈 을 굴리,돈 을 여기 저기 빌리 어 주 어 이익 을 늘리
돈 주,"돈치 기 에서 , 판 에 던지 ᆫ 돈 가운데 맞히 ᆯ 것 을 손 가락 으로 가리키"
돈 을 주,"돈치 기 에서 , 판 에 던지 ᆫ 돈 가운데 맞히 ᆯ 것 을 손 가락 으로 가리키"
돈 치,"돈치 기 에서 , 던지 ᆫ 돈 을 목 대 로 맞히"
돈 을 치,"돈치 기 에서 , 던지 ᆫ 돈 을 목 대 로 맞히"
돈 더미 에 깔리,매우 많 은 돈 을 벌 게 되
돈 더미 에 올라앉,갑자기 많 은 돈 을 벌 어 부자 가 되
돈 방석 에 앉,썩 많 은 돈 을 가지 어 안락 하 ᆫ 처지 가 되
돈 을 만지,어떤 일 을 하 여 돈 을 벌
돈 을 먹,뇌물 을 받
돈 을 찌르,남모르 게 뇌물 을 먹이
돈 주머니 털 어 내,있 는 돈 을 몽땅 꺼내 어 쓰 게 하 거나 빼앗 아 내
돈 주머니 를 털 어 내,있 는 돈 을 몽땅 꺼내 어 쓰 게 하 거나 빼앗 아 내
돌 던지,남 의 잘못 을 비난 하
돌 을 던지,남 의 잘못 을 비난 하
돌 뜨,바위 에서 석재 를 만들 어 내
돌 을 뜨,바위 에서 석재 를 만들 어 내
돌개 바람 에 먼지 날리,갑자기 모두 없 어 지 는 것
돌림 방 을 놓,윤간 을 하
돌 을 잡히,아이 의 첫 돌 을 즐기 어 그 날 에 여러 가지 먹 을 것 과 물건 을 차리 어 놓 고 그 아이 로 하여금 마음대로 집 게 하
돗 자리 말 듯 하,무슨 일 을 시원 스럽 게 해치우
동 달,말 을 덧붙이 어서 시작 하
동 을 달,말 을 덧붙이 어서 시작 하
동 대,말 따위 를 조리 에 맞 게 하
동 을 대,말 따위 를 조리 에 맞 게 하
동 자르,길 게 토막 을 내 서 끊
동 을 자르,길 게 토막 을 내 서 끊
동 끊기,뒤 가 계속 되 지 못하 고 끊 어 지
동 이 끊기,뒤 가 계속 되 지 못하 고 끊 어 지
동강 치,동강 이 나 게 자르
동강 을 치,동강 이 나 게 자르
동곳 빼,힘 이 모자라 서 복종 하
동곳 을 빼,힘 이 모자라 서 복종 하
동냥 가,제대로 듣 고 보 지 못하 거나 손 을 놀리 기 싫 어 하 는 사람 을 타박 하
동냥 보내,제대로 듣 고 보 지 못하 거나 손 을 놀리 기 싫 어 하 는 사람 을 타박 하
동냥 을 가,제대로 듣 고 보 지 못하 거나 손 을 놀리 기 싫 어 하 는 사람 을 타박 하
동냥 을 보내,제대로 듣 고 보 지 못하 거나 손 을 놀리 기 싫 어 하 는 사람 을 타박 하
동네 북 치 듯 하,이 사람 저 사람 이 달려들 어 마 구 때리
동떨어지 ᆫ 소리,조리 가 맞 지 아니하 ᆫ 말
동록 오르,동록 이 생기 어서 퍼렇 게 되
동록 이 오르,동록 이 생기 어서 퍼렇 게 되
동부 노굿 일,동부 의 꽃 이 피
동 살 잡히,동 이 트 어서 훤하 ᆫ 햇 살 이 비치 기 시작 하
동 살 이 잡히,동 이 트 어서 훤하 ᆫ 햇 살 이 비치 기 시작 하
동서 를 모르,아주 쉽 ᆫ 일 이나 기본 적 이 ᆫ 사물 의 이치 조차 분간 하 ᆯ 줄 모르
동안 뜨,거리 가 멀
동안 이 뜨,거리 가 멀
동태 가 되,추위 로 몹시 얼
돼먹 지 않,사람 이 말 이나 행동 이 사리 에 어긋나 ᆫ 데 가 있
돼먹 지 못하,사람 이 말 이나 행동 이 사리 에 어긋나 ᆫ 데 가 있
돼지 멱따 는 소리,아주 듣 기 싫 도록 꽥꽥 지르 는 소리
되 어 들 고 되,많 은 사람 이 뒤 를 이 어 들 고 나
되잡 아 흥,나무람 을 들 을 사람 이 도리어 남 을 나무라
되 지 도 않 는 소리,전혀 실현 가능 성 이 없 는 의견
되짚,나무람 을 들 을 사람 이 도리어 남 을 나무라
된 똥 싸,몹시 혼나
된 방망이 를 맞,몹시 심하 ᆫ 타격 을 받
된 서리 를 맞,모질 ᆫ 재앙 이나 억압 을 당하
된 서방 맞,몹시 어렵 고 까다롭 ᆫ 일 을 당하
된 서방 만나,몹시 어렵 고 까다롭 ᆫ 일 을 당하
된 서방 을 맞,몹시 어렵 고 까다롭 ᆫ 일 을 당하
된 서방 을 만나,몹시 어렵 고 까다롭 ᆫ 일 을 당하
된 서방 에 걸리,몹시 어렵 고 까다롭 ᆫ 일 을 당하
두 고 보,어떤 결과 가 되 ᆯ지 를 일정 기간 동안 살펴보
두 길마 보다,어느 한 쪽 이 잘못 되 더라도 자기 에게 불리 하 게 되 지 아니하 도록 두 쪽 에 다 관계 를 가지 고 살펴보
두 길 보다,어느 한 쪽 이 잘못 되 더라도 자기 에게 불리 하 게 되 지 아니하 도록 두 쪽 에 다 관계 를 가지 고 살펴보
두 길마 를 보,어느 한 쪽 이 잘못 되 더라도 자기 에게 불리 하 게 되 지 아니하 도록 두 쪽 에 다 관계 를 가지 고 살펴보
두 길 을 보,어느 한 쪽 이 잘못 되 더라도 자기 에게 불리 하 게 되 지 아니하 도록 두 쪽 에 다 관계 를 가지 고 살펴보
두 눈 에서 불 이 번쩍 나 게,두 눈 에서 불 이 일 이 도록 날래 거나 예리 하 게
두 다리 뻗,걱정 되 거나 애쓰 던 일 이 끝 나 마음 을 놓
두 다리 펴,걱정 되 거나 애쓰 던 일 이 끝 나 마음 을 놓
두 다리 를 뻗,걱정 되 거나 애쓰 던 일 이 끝 나 마음 을 놓
두 다리 를 펴,걱정 되 거나 애쓰 던 일 이 끝 나 마음 을 놓
두 다리 를 걸치,양 쪽 에서 이익 을 보 려고 두 편 에 다 관계 를 가지
두 동 싸,이렇 ᆯ까 저러 ᆯ까 하 고 망설이 어 확고 하 ᆫ 결심 이 없
두 동 이 싸,이렇 ᆯ까 저러 ᆯ까 하 고 망설이 어 확고 하 ᆫ 결심 이 없
두 동 지,서로 모순 이 되 어 앞 뒤 가 맞 지 않
두 동 이 지,서로 모순 이 되 어 앞 뒤 가 맞 지 않
두레 먹,여러 사람 이 둘러앉 아 먹
두레 를 먹,여러 사람 이 둘러앉 아 먹
두루미 꽁지 같,머리 카락 이나 수염 이 숱 이 많 고 짧 으며 더부룩 하
두 말 다시 하 았 다가 ᆫ,조금 이 라도 다른 말 을 하 ᆫ다면
두 말 만 하 면,조금 이 라도 다른 말 을 하 ᆫ다면
두 말 못 하,더 이상 은 이렇 다 저렇 다 말 하 지 못하 고 기죽 어 있
두 말 하 면 잔 소리,이미 말 하 ᆫ 내용 이 틀림없 으므로 더 말 하 ᆯ 필요 가 없 음
두 말 하 면 숨차 기,이미 말 하 ᆫ 내용 이 틀림없 으므로 더 말 하 ᆯ 필요 가 없 음
두 말 하 면 여담,이미 말 하 ᆫ 내용 이 틀림없 으므로 더 말 하 ᆯ 필요 가 없 음
두 말 하 ᆯ 나위 없,너무나 자명 하 여 군 말 을 더 보태 ᆯ 여지 가 없
두 말 하 ᆯ 나위 가 없,너무나 자명 하 여 군 말 을 더 보태 ᆯ 여지 가 없
두 부모 베,어떤 요구 를 여지없이 거절 하 ᄆ
두 부모 자르,어떤 요구 를 여지없이 거절 하 ᄆ
두 부모 를 베,어떤 요구 를 여지없이 거절 하 ᄆ
두 부모 를 자르,어떤 요구 를 여지없이 거절 하 ᄆ
두 손 들,자기 능력 에서 벗어나 아 그만두
두 손 을 들,자기 능력 에서 벗어나 아 그만두
두 손 두 발 들,자기 능력 에서 벗어나 아 그만두
두 손 두 발 다 들,자기 능력 에서 벗어나 아 그만두
두 손 맞잡 고 앉,아무 일 도 하 지 아니하 고 가만히 있
두 손 털 고 나서,가지 ᆫ 것 을 다 잃 고 남 은 것 이 없이 물러나
두 수 보다,하나 를 통하 여 두 곳 에서 이익 을 보 거나 잇따르 아 두 번 이익 을 보
두 수 를 보,하나 를 통하 여 두 곳 에서 이익 을 보 거나 잇따르 아 두 번 이익 을 보
두 주머니 차 이 다,본래 의 목적 대로 쓰 ᆯ 돈 에서 개인 적 으로 쓰 ᆯ 돈 을 몰래 빼 서 각각 보관 하
두 주머니 를 차,본래 의 목적 대로 쓰 ᆯ 돈 에서 개인 적 으로 쓰 ᆯ 돈 을 몰래 빼 서 각각 보관 하
두 통 을 앓,골칫 거리 가 있 어서 생각 이 복잡 하 고 괴롭
두 활개 를 펴,의기양양 하 여 혼자 마음대로 놀
둘 도 없,오직 하나 뿐 이 고 더 이상 은 없
둘째 치,부차 적 이 ᆫ 것 으로 돌리 거나 대수롭 지 않 은 것 으로 여기
둘째 로 치,부차 적 이 ᆫ 것 으로 돌리 거나 대수롭 지 않 은 것 으로 여기
둘째 가 라면 서럽,자타 가 공인 하 는 첫 째 이 다
둘째 가 라면 섧,자타 가 공인 하 는 첫 째 이 다
둘째 로 치,대상 이나 고려 의 범위 에서 빼
둥둥 떠다니,안 착하 지 못하 고 일정 하 ᆫ 목적 이 없이 들뜨 어 돌아다니
둥둥 뜨 어 있,마음 이 안정 되 지 못하 고 들뜨 어 있
둥지 치,보금 자리 를 만들
둥지 틀,보금 자리 를 만들
둥지 를 치,보금 자리 를 만들
둥지 를 틀,보금 자리 를 만들
뒤 구리,숨기 어 두 ᆫ 약점 이나 잘못 이 있
뒤 가 구리,숨기 어 두 ᆫ 약점 이나 잘못 이 있
뒤 나,자기 의 잘못 이나 약점 으로 뒤 에 가 서 좋 지 않 은 일 이 생기 ᆯ 것 같 아 마음 이 놓이 지 않
뒤 가 나,자기 의 잘못 이나 약점 으로 뒤 에 가 서 좋 지 않 은 일 이 생기 ᆯ 것 같 아 마음 이 놓이 지 않
뒤 가 깨끗 하,숨기 어 두 ᆫ 약점 이나 잘못 이 없
뒤 가 꿀리,자신 의 약점 때문 에 떳떳 하 지 못하 고 마음 이 켕기
뒤 가 늘어지,끝 을 맺 는 것 이 느리
뒤 가 드러나,비밀 로 하 거나 숨기 ᆫ 일 이 나타나 거나 알리 어 지
뒤 가 든든 하,뒤 에서 받치 어 주 는 세력 이나 사람 이 있
뒤 가 들리,비밀 로 하 거나 숨기 ᆫ 일 이 나타나 거나 알리 어 지
뒤 가 무겁,병 을 앓 고 나 ᆫ 뒤 끝 이 거뜬 하 지 아니하
뒤 가 무사 하,어떤 일 의 뒤 끝 에 대하 여 걱정 하 ᆯ 만 하 ᆫ 것 이 전혀 없 거나 걱정 을 하 지 않 아도 되
뒤 가 저리,자기 가 한 말 이나 행동 이 나중 에 잘못 되 ᆯ까 보 아 마음 이 조마조마 하 거나 두렵 ᆫ 느낌 이 있
뒤 가 켕기,약점 이나 잘못 이 있 어 마음 이 편하 지 아니하
뒤 꼬리 따르,뒤떨어지 어서 소극 적 이 며 피동 적 으로 움직이
뒤 꼬리 를 따르,뒤떨어지 어서 소극 적 이 며 피동 적 으로 움직이
뒤 꽁무니 빼,달아나 거나 도망치
뒤 꽁무니 를 빼,달아나 거나 도망치
뒤 끝 보다,일 이 진행 되 어 가 는 결과 를 보
뒤 끝 을 보,일 이 진행 되 어 가 는 결과 를 보
뒤 끝 흐리,어떤 일 의 끝 맺 음 이 확실 하 지 않
뒤 끝 이 흐리,어떤 일 의 끝 맺 음 이 확실 하 지 않
뒤 로 돌리,중요 하 게 다루 지 아니하
뒤 로 물러나,직임 이나 사회 활동 에서 은퇴 하
뒤 로 빠지,직임 이나 사회 활동 에서 은퇴 하
뒤 를 거두,뒷 일 을 수습 하
뒤 를 노리,결함 이나 약점 을 찾아내 려고 기회 를 엿보
뒤 를 누르,뒷 일 을 걱정 하 여 미리 다지 ᄆ 받
뒤 를 다지,뒷 일 이 잘못 되 지 않 게 하 기 위하 여 미리 다지 ᄆ 받
뒤 를 달,앞 에서 한 말 에 뒤 를 잇 어서 보충 하 여 말 하
뒤 를 두,어떤 좋 지 않 은 감정 이나 느낌 따위 를 버리 지 않 고 계속 품 고 있
뒤 를 맑히,일 의 뒤 끝 을 깨끗이 정리 하 거나 처리 하
뒤 를 맡기,뒷 일 을 맡기
뒤 를 물,뒤 가 계속 이 어 지
뒤 를 뭉개,행동 을 빨리빨리 하 지 못하 고 늘어지
뒤 를 밀,앞 으로 전진 하 거나 빨리 발전 하 도록 지지 하 여 주 거나 돕 아 주
뒤 를 받들,존경 하 는 사람 의 위업 을 따르 며 이어받
뒤 를 받치,어떤 일 을 뒷 받침 하 아 주
뒤 를 빼,발 뺌 을 하
뒤 를 사리,뒷 일 이 잘못 되 ᆯ까 보 아 미리 발 뺌 을 하 거나 조심 하
뒤 를 재,어떤 일 의 결과 를 걱정 하 면서 이것 저것 타산 을 맞추 어 보
뒤 를 캐,드러나 지 않 은 속 이나 행동 을 알아내 려고 은밀히 뒷 조사 를 하
뒤 를 풀,맺히 ᆫ 감정 을 누그러지 게 하 거나 없 어 지 게 하
뒤집 고 핥,속속들이 자세히 알
뒤 턱 놓,노름 판 에서 남 에게 붙 어 돈 을 걸
뒤 턱 보다,노름 판 에서 남 에게 붙 어 돈 을 걸
뒤 턱 을 놓,노름 판 에서 남 에게 붙 어 돈 을 걸
뒤 턱 을 보,노름 판 에서 남 에게 붙 어 돈 을 걸
뒤 통수 때리,믿 음 과 의리 를 저버리
뒤 통수 를 때리,믿 음 과 의리 를 저버리
뒤 통수 맞,배신 이나 배반 을 당하
뒤 통수 를 맞,배신 이나 배반 을 당하
뒷 구멍 으로 들어가,비 정상 적 이 ᆫ 방법 으로 구성 원 이 되
뒷 구멍 을 캐,남 의 허물 을 찾아내
뒷 구멍 을 파,남 의 허물 을 찾아내
뒷 길 두,빠지 어 나가 ᆯ 수 있 는 여지 를 남기 어 두
뒷 길 을 두,빠지 어 나가 ᆯ 수 있 는 여지 를 남기 어 두
뒷 다리 잡히,상대 편 에게 약점 이 잡히 어 벗어나 지 못하 게 되
뒷 다리 가 / 를 잡히,상대 편 에게 약점 이 잡히 어 벗어나 지 못하 게 되
뒷 다리 긁,다 끝나 ᆫ 말 을 다시 하 여 되통 스럽 게 굴
뒷 다리 를 긁,다 끝나 ᆫ 말 을 다시 하 여 되통 스럽 게 굴
뒷 다리 잡,상대 편 의 약점 을 잡 아 벗어나 지 못하 게 하
뒷 다리 를 잡,상대 편 의 약점 을 잡 아 벗어나 지 못하 게 하
뒷 덜미 를 잡히,꼼짝 못 하 고 잡히
뒷 맛 이 쓰,어떤 일 이 끝나 ᆫ 다음 에 남 은 느낌 이 좋 지 않
뒷 문 으로 드나들,사람 들 이 모르 게 은밀히 드나들
뒷 손 쓰,은밀히 대책 을 강구 하 거나 뒷 수습 을 하
뒷 손 을 쓰,은밀히 대책 을 강구 하 거나 뒷 수습 을 하
뒷 짐 지,어떤 일 에 자신 은 전혀 상관없 는 것 처럼 구경 만 하 고 있
뒷 짐 짚,어떤 일 에 자신 은 전혀 상관없 는 것 처럼 구경 만 하 고 있
뒷 짐 을 지,어떤 일 에 자신 은 전혀 상관없 는 것 처럼 구경 만 하 고 있
뒷 짐 을 짚,어떤 일 에 자신 은 전혀 상관없 는 것 처럼 구경 만 하 고 있
뒷 짐 지우,두 손 을 등 뒤 로 젖히 고 묶
뒷 짐 을 지우,두 손 을 등 뒤 로 젖히 고 묶
드 나 놓 으나 하나 뿐 이,오직 하나 뿐 이
드렁 조 로 듣,나 와 는 전혀 상관없 다는 듯이 건성 으로 듣
듣 거니 맺,눈 물 따위 가 글썽글썽 하 여 방울방울 떨어지 거니 맺히
듣,지금 까지 들 어 보 지 못하 던 내용 의 말 을 처음 으로 듣 게 되 었 음 을 이르 는 말
듣 도 보 도 못하,들 은 적 도 보 ᆫ 적 도 없 어 전혀 알 지 못하
들 머리 판 내,다 들어먹 고 끝 장 이 나 게 하
들 머리 판 을 내,다 들어먹 고 끝 장 이 나 게 하
들 숨 날 숨 없,꼼짝달싹 하 ᆯ 수 없 는 지경 이나 형편 에 처하 여 있
들 었 다 놓,굉장히 크 ᆫ 영향 을 미치
등 대,남 의 세력 에 의지 하
등 을 대,남 의 세력 에 의지 하
등 돌리,뜻 을 같이 하 던 사람 이나 단체 와 관계 를 끊 고 배척 하
등 을 돌리,뜻 을 같이 하 던 사람 이나 단체 와 관계 를 끊 고 배척 하
등 타,산 등성이 로 따르 아 가
등 을 타,산 등성이 로 따르 아 가
등 달,마음대로 되 지 아니하 여 몹시 안타깝 어 하
등 이 달,마음대로 되 지 아니하 여 몹시 안타깝 어 하
등 닿,뒤 로 힘 있 는 곳 에 의지 하 게 되
등 이 닿,뒤 로 힘 있 는 곳 에 의지 하 게 되
등 골 빨아먹,남 의 재물 을 착취 하 거나 농락 하 며 빼앗 아 먹
등 골 빼먹,남 의 재물 을 착취 하 거나 농락 하 며 빼앗 아 먹
등 골 을 빨아먹,남 의 재물 을 착취 하 거나 농락 하 며 빼앗 아 먹
등 골 을 빼먹,남 의 재물 을 착취 하 거나 농락 하 며 빼앗 아 먹
등 골 뽑,재물 을 훑 어 먹 거나 남 을 몹시 고생 스럽 게 하
등 골 을 뽑,재물 을 훑 어 먹 거나 남 을 몹시 고생 스럽 게 하
등 골 우리 이 다,달래 거나 위협 하 여 남 의 재물 을 억지로 빼앗
등 골 을 우리,달래 거나 위협 하 여 남 의 재물 을 억지로 빼앗
등 골 빠지,견디 기 어렵 ᆯ 정도 로 몹시 힘 이 들
등 골 이 빠지,견디 기 어렵 ᆯ 정도 로 몹시 힘 이 들
등 골 서늘 하,두려움 으로 아찔 하 고 등 골 이 떨리
등 골 이 서늘 하,두려움 으로 아찔 하 고 등 골 이 떨리
등 골 오싹 하,등 골 에 소름 이 끼치 ᆯ 정도 로 매우 놀라 거나 두렵
등 골 이 오싹 하,등 골 에 소름 이 끼치 ᆯ 정도 로 매우 놀라 거나 두렵
등 껍질 벗기,심하 게 닦달 하
등 껍질 을 벗기,심하 게 닦달 하
등 살 달,일 이 뜻대로 되 지 않 아 몹시 안타깝 어 하
등 살 이 달,일 이 뜻대로 되 지 않 아 몹시 안타깝 어 하
등 살 바르,등 의 힘 살 이 뻣뻣 하 여 굽히 었 다 펴 었 다 하 기에 거북 하
등 살 이 바르,등 의 힘 살 이 뻣뻣 하 여 굽히 었 다 펴 었 다 하 기에 거북 하
등 살 이 꼿꼿 하,매우 거북 하 거나 고되 어 꼼짝달싹 하 ᆯ 수 가 없
등쌀 대,지겹 도록 몹시 귀찮 게 하
등쌀 을 대,지겹 도록 몹시 귀찮 게 하
등 에 찬 물 을 끼얹 는 듯,정신 이 아찔 하 고 몹시 긴장 되 ᄆ
등 을 긁어먹,음흉 하 고 교활 하 게 남 의 재물 을 빼앗
등 을 갉아먹,음흉 하 고 교활 하 게 남 의 재물 을 빼앗
등 을 떠밀,일 을 억지로 시키 거나 부추기
등 을 벗기 어 먹,위협 하 여 남 의 재물 을 빼앗
등자 치,어떤 글 을 대조 하 여 보 ᆯ 때 맞
등자 를 치,어떤 글 을 대조 하 여 보 ᆯ 때 맞
등 하 지 ᆫ 가,남 의 세력 에 의지 하 고 있 는 사람
따리 붙이,남 의 마음 을 사 려고 아첨 하
따리 를 붙이,남 의 마음 을 사 려고 아첨 하
딱 부러지 게,아주 단호 하 게
딱 자르 ㅏ,아주 단호 하 게
딱지 가 덜 떨어지,어리 고 유치 하 ᄆ 을 벗어나 지 못하 ᆫ 상태
딴 것 이 아니,다른 까닭 이 있 는 것 이 아니
딴 주머니 를 차,다른 속 셈 을 가지
땀 빼,몹시 힘들 거나 어렵 ᆫ 고비 를 겪 느라고 크 게 혼 이 나
땀 을 빼,몹시 힘들 거나 어렵 ᆫ 고비 를 겪 느라고 크 게 혼 이 나
땀 흘리,힘 이나 노력 을 많이 들 이
땀 을 흘리,힘 이나 노력 을 많이 들 이
땀 으로 미역 을 감,땀 을 매우 많이 흘리
땀 을 들이,잠시 휴식 하
땀 이 빠지,몹시 힘들 거나 애 가 쓰이
땅 꺼지 게,한 숨 을 쉬 ᆯ 때 몹시 깊 고 도 크 게
땅 꺼지,한 숨 을 쉬 ᆯ 때 몹시 깊 고 도 크 게
땅 이 꺼지 게,한 숨 을 쉬 ᆯ 때 몹시 깊 고 도 크 게
땅 이 꺼지,한 숨 을 쉬 ᆯ 때 몹시 깊 고 도 크 게
땅 내 맡,식물 이 새롭 ᆫ 땅 에 뿌리 를 내리 어 생기 있는 상태 가 되
땅 내 를 맡,식물 이 새롭 ᆫ 땅 에 뿌리 를 내리 어 생기 있는 상태 가 되
땅 띔 못 하,감히 생각 조차 못 하
땅 띔 도 못 하,감히 생각 조차 못 하
땅 방울 같이 으르,몹시 심하 게 위협 하
땅 에 떨어지,명예 나 권위 따위 가 회복 하 기 어렵 ᆯ 정도 로 손상 되
땅 을 치 ᆯ 노릇,몹시 분하 고 애 통 하 ᄆ
때 빼 고 광내,멋 을 내
떠오르 는 달,인물 이 훤하 고 아름답 ᄆ
떠오르 는 별,새로이 등장 하 여 두각 을 나타내 는 사람
떡 되,크 게 곤욕 을 당하 거나 매 를 많이 맞
떡 이 되,크 게 곤욕 을 당하 거나 매 를 많이 맞
떡 국 을 먹,나이 를 한 살 더 먹
떡 먹,쉽 게
떡 심 좋,몹시 끈 기 있 게 질기 도록 비위 가 좋
떡 심 이 좋,몹시 끈 기 있 게 질기 도록 비위 가 좋
떡 심 풀리,낙담 하 여 맥 이 풀리
떡 심 이 풀리,낙담 하 여 맥 이 풀리
떡 을 치,충분 하
떡 이 생기,뜻밖에 이익 이 생기
떡 주무르 듯 하,저 하 고 싶 은 대로 마음대로 다루
떨어지 지 않 는 발 길,떠나 고 싶 지 않 거나 내키 지 않 는 발 길
똥 뀌,방귀 를 뀌
똥 을 뀌,방귀 를 뀌
똥 밟,재수 가 없
똥 을 밟,재수 가 없
똥 싸,몹시 힘들
똥 을 싸,몹시 힘들
똥 되,체면 이 형편없이 되
똥 이 되,체면 이 형편없이 되
똥 구멍 찢어지,몹시 가난 하 ᆫ 살림 살이
똥 구멍 째지,몹시 가난 하 ᆫ 살림 살이
똥 구멍 이 찢어지,몹시 가난 하 ᆫ 살림 살이
똥 구멍 이 째지,몹시 가난 하 ᆫ 살림 살이
똥 끝 타,몹시 힘 이 들 거나 마음 을 졸이
똥 끝 이 타,몹시 힘 이 들 거나 마음 을 졸이
똥 넉 가래 내세우,대단 하 지 도 않 은 일 을 걸핏하면 들먹이 어 내세우 는 모양
똥 물 에 튀 하 ᆯ 놈,아무 짝 에 도 쓸모없 는 사람
똥 바가지 를 쓰,망신 을 당하
똥 오줌 을 못 가리,사리 분별 을 못 하
똥 줄 나 게,혼 이 나 서 매우 급하 게
똥 줄 이 나 게,혼 이 나 서 매우 급하 게
똥 줄 당기,몹시 마음 을 졸이 거나 두렵 어 겁 을 내
똥 줄 이 당기,몹시 마음 을 졸이 거나 두렵 어 겁 을 내
똥 줄 빠지 게,몹시 힘들
똥 줄 이 빠지 게,몹시 힘들
똥 줄 타,몹시 힘 이 들 거나 마음 을 졸이
똥 줄 이 타,몹시 힘 이 들 거나 마음 을 졸이
똥 집 무겁,엉덩이 가 무겁
똥 집 질기,엉덩이 가 무겁
똥 집 이 무겁,엉덩이 가 무겁
똥 집 이 질기,엉덩이 가 무겁
똥 차 가 밀리,위 로 결혼 하 지 않 은 형 이나 언니 가 있 어 결혼 하 지 못하
똥 창 맞,뜻 이 서로 맞
똥 창 이 맞,뜻 이 서로 맞
똥 탈 나,급하 ᆫ 탈 이 생기
똥 탈 이 나,급하 ᆫ 탈 이 생기
뚜껑 열,내용 이나 결과 를 보
뚜껑 을 열,내용 이나 결과 를 보
뚜껑 을 덮,하 던 말 이나 일 을 그만두
뚜껑 이 열리,화 가 나
뛰 지 도 걷 지 도 못하,이러 지 도 저러 지 도 못하 는 매우 난처 하 ᆫ 처지 에 빠지 어 옴짝달싹 못 하
뜨겁 ᆫ 맛 을 보,호되 ᆫ 고통 이나 어려움 을 겪
뜬 구름 잡,막연 하 거나 허황 되 ᆫ 것 을 좇
뜬 구름 을 잡,막연 하 거나 허황 되 ᆫ 것 을 좇
뜸 들 이,서둘 지 않 고 하 ᆫ 동안 가만히 있 는 경우
뜸 을 들이,서둘 지 않 고 하 ᆫ 동안 가만히 있 는 경우
뜻 받,뜻 을 이어받 아서 그대로 따르 아 하
뜻 을 받,뜻 을 이어받 아서 그대로 따르 아 하
뜻 세우,장래 의 목표 를 마음 에 품 고 결심 하
뜻 을 세우,장래 의 목표 를 마음 에 품 고 결심 하
뜻 맞,서로 생각 이 같
뜻 이 맞,서로 생각 이 같
마각 을 드러내,숨기 고 있 던 일 이나 정체 를 드러내
마각 이 드러나,숨기 고 있 던 일 이나 정체 가 드러나
마당 빌리,신랑 이 신부 의 집 에 가 서 초 례식 을 지내
마당 을 빌리,신랑 이 신부 의 집 에 가 서 초 례식 을 지내
마른 벼락 을 맞,갑자기 뜻 밖 의 재난 을 당하
마른 벼락 이 떨어지,갑자기 뜻 밖 의 재난 을 당하
마른 벼락 이 내리,갑자기 뜻 밖 의 재난 을 당하
마른 침 을 삼키,몹시 긴장 하 거나 초조 하 아 하
마마 그릇 되,좋 지 않 은 징조 가 보임 을 이르 는 말
마마 손 님 배송 하,달래 고 어르 어서 잘 보내 기 만 하 ᄆ
마술 걸,마술 을 쓰 어서 상대 편 의 판단 을 흐리 게 하 여 정신 을 빼앗
마술 을 걸,마술 을 쓰 어서 상대 편 의 판단 을 흐리 게 하 여 정신 을 빼앗
마음 붙이,어떤 것 에 마음 을 자리 잡 게 하 거나 전념 하
마음 을 붙이,어떤 것 에 마음 을 자리 잡 게 하 거나 전념 하
마음 주,마음 을 숨기 지 아니하 고 기꺼이 내보이
마음 을 주,마음 을 숨기 지 아니하 고 기꺼이 내보이
마음 에 두,잊 지 아니하 고 마음 속 에 새기 어 두
마음 에 붙,마음 에 맞 아 불만 스럽 어 하 지 아니하 고 안착 되
마음 에 없,무엇 을 하 거나 가지 고 싶 은 생각 이 없
마음 에 있,무엇 을 하 거나 가지 고 싶 은 생각 이 있
마음 에 차,마음 에 흡족 하 게 여기
마음 을 삭이,맺히 거나 격하 ᆫ 감정 을 가라앉히
마음 을 썩이,몹시 괴롭 어 하
마음 을 풀,긴장 하 였 던 마음 을 늦추
마음 이 돌아서,가지 었 던 마음 이 아주 달라지
마음 이 삭,맺히 거나 격하 ᆫ 감정 이 가라앉
마음 이 통하,서로 생각 이 같 아 이해 가 잘 되
마음 이 풀리,마음 속 에 맺히 거나 틀어지 ㅓㅆ 던 것 이 없 어 지
마침 표 를 찍,끝 장 을 내
막 다른 골목,더 는 어떻게 하 ᆯ 수 없 는 절박 하 ᆫ 경우
막다르 ᆫ 골,더 는 어떻게 하 ᆯ 수 없 는 절박 하 ᆫ 경우
막 을 내리,무대 의 공연 이나 어떤 행사 를 마치
막 이 내리,무대 의 공연 이나 어떤 행사 를 마치
막 을 열,무대 의 공연 이나 어떤 행사 를 시작 하
막 을 올리,무대 의 공연 이나 어떤 행사 를 시작 하
막 이 오르,무대 의 공연 이나 어떤 행사 가 시작 되
막 차 를 타,끝 나 가 ᆯ 무렵 에 뒤늦 게 뛰어들
막하 잡,주장 이 자기 가 거느리 ᆯ 막하 를 선택 하
막하 를 잡,주장 이 자기 가 거느리 ᆯ 막하 를 선택 하
만광 트,광주 가 광산 을 직접 경영 하 지 아니하 고 덕 대 에게 채굴 권 을 허락 하
