idiom,meaning
가꾸로 박히,머리 를 땅 으로 향하 ᆫ 채 떨어지
가난 들,가난 하 게 되
가난 이 들,가난 하 게 되
가난 이 파고들,더욱더 가난 하 아 지
가늠 보다,형편 이나 시세 따위 를 살피
가늠 을 보,형편 이나 시세 따위 를 살피
가늠 잡,형편 이나 시세 따위 를 살피
가늠 을 잡,형편 이나 시세 따위 를 살피
가늠 이 가,짐작 이나 헤아리 ᄆ 이 이루어지 거나 미치
가닥 을 잡,"분위기 , 상황 , 생각 따위 를 이치 나 논리 에 따르 아 바로잡"
가닥 이 잡히,"분위기 , 상황 , 생각 따위 를 이치 나 논리 에 따르 아 바로잡 게 하"
가 도 오 도 못하,한 곳 에서 자리 를 옮기 거나 움직이 ᆯ 수 없 는 상태 가 되
가락 떼,흥 이 나 는 일 에 첫 동작 을 실행 하
가락 을 떼,흥 이 나 는 일 에 첫 동작 을 실행 하
가락 나,일 하 는 기운 이나 능률 이 오르
가락 이 나,일 하 는 기운 이나 능률 이 오르
가락 맞,행동 이 서로 잘 들어맞
가락 이 맞,행동 이 서로 잘 들어맞
가락 을 내,"윷 놀이 를 하 ᆯ 때 , 윷 가락 을 잘 던지 어서 원 하 는 대로 엎 기 도 하 고 잦히 기 도 하 ᆫ다"
가락 을 받,남 의 소리 나 노래 의 뒤 를 이 어 부르
가랑 이 찢어지,하 는 일 이 힘 에 부치 거나 일 손 이 부족 하 여 일 하 아 나가 기 가 몹시 벅차
가랑 이 째지,하 는 일 이 힘 에 부치 거나 일 손 이 부족 하 여 일 하 아 나가 기 가 몹시 벅차
가랑이 가 찢어지,하 는 일 이 힘 에 부치 거나 일 손 이 부족 하 여 일 하 아 나가 기 가 몹시 벅차
가랑이 가 째지,하 는 일 이 힘 에 부치 거나 일 손 이 부족 하 여 일 하 아 나가 기 가 몹시 벅차
가렵 ᆫ 곳 을 긁 어 주,남 에게 꼭 필요 하 ᆫ 것 을 잘 알 아서 그 욕구 를 시원 스럽 게 만족 시키 어 주
가렵 ᆫ 데 를 긁 어 주,남 에게 꼭 필요 하 ᆫ 것 을 잘 알 아서 그 욕구 를 시원 스럽 게 만족 시키 어 주
가렵 ᆫ 곳 을 긁 어 주,남 에게 꼭 필요 하 ᆫ 것 을 잘 알 아서 그 욕구 를 시원 스럽 게 만족 시키 어 주
가로 뛰 고 세로 뛰,감정 이 북받치 어 이리저리 날뛰
가로 지나 아 세 로 지,이렇게 되 든지 저렇게 되
가리 틀,잘 되 어 가 는 일 을 안 되 도록 방해 하
가리 를 틀,잘 되 어 가 는 일 을 안 되 도록 방해 하
가마 를 태우,그렇 ᆯ 듯 하 게 추어올리 어 얼렁뚱땅 넘어가 거나 속이 어 넘기
가 면 벗,거짓 으로 꾸미 ᆫ 모습 을 버리 고 정체 를 드러내
가면 을 벗,거짓 으로 꾸미 ᆫ 모습 을 버리 고 정체 를 드러내
가 면 쓰,본심 을 감추 고 겉 으로 는 그렇 지 않 은 것 처럼 꾸미
가면 을 쓰,본심 을 감추 고 겉 으로 는 그렇 지 않 은 것 처럼 꾸미
가면 을 벗기,거짓 으로 꾸미 ᆫ 정체 를 밝히
가문 을 흐리,가문 의 명예 를 더럽히
가방 끈 길,많이 배우 어 학력 이 높
가방 끈 이 길,많이 배우 어 학력 이 높
가방 끈 짧,많이 배우 지 못하 아 학력 이 낮
가방 끈 이 짧,많이 배우 지 못하 아 학력 이 낮
가살 빼,거만 하 게 가살 스럽 ᆫ 태도 를 짓
가살 을 빼,거만 하 게 가살 스럽 ᆫ 태도 를 짓
가살 쓰,정신없 고 부산 스럽 ᆫ 행동 을 하
가살 을 쓰,정신없 고 부산 스럽 ᆫ 행동 을 하
가슴 앓,안 달하 여 마음 의 고통 을 느끼
가슴 을 앓,안 달하 여 마음 의 고통 을 느끼
가슴 저미,생각 이나 느낌 이 매우 심각 하 고 간절 하 여 가슴 을 칼 로 베 는 듯 하 ᆫ 아픔 을 느끼 게 하
가슴 을 저미,생각 이나 느낌 이 매우 심각 하 고 간절 하 여 가슴 을 칼 로 베 는 듯 하 ᆫ 아픔 을 느끼 게 하
가슴 치,마음 에 크 ᆫ 충격 을 받
가슴 을 치,마음 에 크 ᆫ 충격 을 받
가슴 태우,몹시 애태우
가슴 을 태우,몹시 애태우
가슴 펴,굽히 ᆯ 것 없이 당당 하
가슴 을 펴,굽히 ᆯ 것 없이 당당 하
가슴 에 멍 이 들,마음 속 에 쓰라리 ᆫ 고통 과 모질 ᆫ 슬픔 이 지우 ᆯ 수 없이 맺히
가슴 에 멍 이 지,마음 속 에 쓰라리 ᆫ 고통 과 모질 ᆫ 슬픔 이 지우 ᆯ 수 없이 맺히
가슴 에 불붙,감정 이 격하 아 지
가슴 에 새기,잊 지 않 게 단단히 마음 에 기억 하
가슴 에 손 을 얹,양심 에 근거 를 두
가슴 에 칼 을 품,모질 ᆫ 마음 을 먹 거나 흉악 하 ᆫ 생각 을 하
가슴 에 피 멍 들,마음 속 에 쓰라리 ᆫ 고통 과 모질 ᆫ 슬픔 이 지우 ᆯ 수 없이 맺히
가슴 에 피 멍 이 들,마음 속 에 쓰라리 ᆫ 고통 과 모질 ᆫ 슬픔 이 지우 ᆯ 수 없이 맺히
가슴 을 도리 어 내,마음 을 아프 게 하
가슴 을 뒤흔들,마음 을 들뜨 게 하 거나 설레 게 하
가슴 을 불태우,어떤 의 욕 이나 기세 가 몹시 끓어오르 ᆫ 상태 에서 활동 하
가슴 을 열,속 마음 을 털어놓 거나 받아들이
가슴 을 짓찧,마음 에 몹시 심하 ᆫ 고통 을 받
가슴 을 찢,슬픔 이나 분하 ᄆ 때문 에 가슴 이 째지 는 듯 하 ᆫ 고통 을 주
가슴 을 헤치 어 놓,마음 속 의 생각 이나 말 을 거리낌 없이 그대로 다 털어놓
가슴 이 찔리,심하 ᆫ 양심 의 가책 을 받
가슴 에 찔리,심하 ᆫ 양심 의 가책 을 받
가슴 이 넓,이해심 이 많
가슴 이 두방망이 질 하,가슴 이 몹시 세차 게 두근거리
가슴 이 뜨겁,깊 고 크 ᆫ 사랑 과 배려 를 받 아 고마움 으로 마음 의 감동 이 크
가슴 이 뜨끔 하,자극 을 받 아 마음 이 깜짝 놀라 거나 양심 의 가책 을 받
가슴 이 막히,크 ᆫ 기쁨 이나 감격 으로 마음 속 이 꽉 차
가슴 이 무겁,슬픔 이나 걱정 으로 마음 이 가라앉
가슴 이 무너지 어 내리,심하 ᆫ 충격 을 받 아 마음 을 다 잡 기 힘들 게 되
가슴 이 미어지,마음 이 슬픔 이나 고통 으로 가득 차 견디 기 힘들 게 되
가슴 이 방망이 질 하,심장 이 몹시 두근거리
가슴 이 서늘 하,두려움 으로 마음 속 에 차 ᆫ 바람 이 이 는 것 같
가슴 이 숯 등걸 이 되,애 가 타 서 마음 이 상하 ᆯ 대로 상하
가슴 이 아리,몹시 가엾 거나 측은 하 여 마음 이 알알 하 게 찌르 는 것 처럼 아프
가슴 이 좁,이해심 이 없
가슴 이 찢어지,슬픔 이나 분하 ᄆ 때문 에 가슴 이 째지 는 듯 하 ᆫ 고통 을 받
가슴 이 콩 알 만 하,불안 하 고 초조 하 여 마음 을 펴 지 못하 고 있
가슴 이 콩 알 만 하 아 지,불안 하 고 초조 하 여 마음 을 펴 지 못하 고 있
가슴 이 타,마음 속 으로 고민 하 여 가슴 이 뜨거워지 는 것 같
가슴 이 트이,마음 속 에 맺히 ᆫ 것 이 풀리 어 환하 아 지
가시 돋 아시,공격 의 의도 나 불평 불만 이 있
가시 가 돋 아시,공격 의 의도 나 불평 불만 이 있
가시 돋치,공격 의 의도 나 불평 불만 이 있
가시 가 돋치,공격 의 의도 나 불평 불만 이 있
가시 박히,말 속 에 악의 가 있
가시 가 박히,말 속 에 악의 가 있
가시 세,앙칼지 고 고집 이 세
가시 가 세,앙칼지 고 고집 이 세
가시 먹 은 것 같,남 에게서 받 거나 얻어먹 은 것 이 마음 에 걸리 어 꺼림칙 하
가시 밭 길 을 가,힘겹 고 험하 ᆫ 삶 을 살
가위 다리 치,서로 어 긋 매 끼 ㅓ 놓
가위 다리 를 치,서로 어 긋 매 끼 ㅓ 놓
가재 치,사 ㅏㅆ 던 물건 을 도로 무르
가재 를 치,사 ㅏㅆ 던 물건 을 도로 무르
가정 오랑캐 맞,매 를 몹시 맞
가죽 만 남,보 기 흉하 게 여위
가지 치,하나 의 근본 에서 딴 갈래 가 생기
가지 를 치,하나 의 근본 에서 딴 갈래 가 생기
가지 고 놀,사람 을 놀리 거나 멸시 하
각 뜨,"잡 은 짐승 을 머리 , 다리 따위 로 나누"
각 을 뜨,"잡 은 짐승 을 머리 , 다리 따위 로 나누"
간 바람 들,하 는 행동 이 실없
간 에 바람 들,하 는 행동 이 실없
간 불붙,몹시 울화 가 나
간 에 불붙,몹시 울화 가 나
간 빼 어 먹,겉 으로 는 비위 를 맞추 며 좋 게 대하 는 척하 면서 요긴 하 ᆫ 것 을 다 빼앗
간 을 빼 어 먹,겉 으로 는 비위 를 맞추 며 좋 게 대하 는 척하 면서 요긴 하 ᆫ 것 을 다 빼앗
간 졸이,매우 걱정 되 고 불안 스럽 어 마음 을 놓 지 못하
간 을 졸이,매우 걱정 되 고 불안 스럽 어 마음 을 놓 지 못하
간 뒤집히,까닭 없이 웃
간 이 뒤집히,까닭 없이 웃
간 떨어지,몹시 놀라
간 이 떨어지,몹시 놀라
간 마르,몹시 초조 하 거나 안타깝 어서 속 이 상하
간 이 마르,몹시 초조 하 거나 안타깝 어서 속 이 상하
간 붓,지나치 게 대담 하 아 지
간 이 붓,지나치 게 대담 하 아 지
간 작,대담 하 지 못하 고 몹시 겁 이 많
간 이 작,대담 하 지 못하 고 몹시 겁 이 많
간 크,겁 이 없 고 매우 대담 하
간 이 크,겁 이 없 고 매우 대담 하
간 타,너무 근심 스럽 고 안타깝 어 속 이 타 는 듯 하
간 이 타,너무 근심 스럽 고 안타깝 어 속 이 타 는 듯 하
간담 을 헤치,속 마음 을 숨김없이 다 말 하
간담 이 내려앉,몹시 놀라
간담 이 떨어지,몹시 놀라
간담 이 서늘 하,몹시 놀라 서 섬뜩 하
간담 이 한 움큼 되,몹시 놀라 고 두려워하
간 덩이 붓,지나치 게 대담 하 아 지
간 덩이 가 붓,지나치 게 대담 하 아 지
간 덩이 작,대담 하 지 못하 고 몹시 겁 이 많
간 덩이 가 작,대담 하 지 못하 고 몹시 겁 이 많
간 덩이 크,겁 이 없 고 매우 대담 하
간 덩이 가 크,겁 이 없 고 매우 대담 하
간 덩이 를 키우,담력 과 도량 을 늘리
간 도 모르,일 의 내막 을 짐작 도 하 지 못하
간 도 쓸개 도 없,용기 나 줏 대 없이 남 에게 굽히
간땡이 붓,지나치 게 대담 하 아 지
간땡이 가 붓,지나치 게 대담 하 아 지
간땡이 크,대담 하 지 못하 고 몹시 겁 이 많
간땡이 가 크,대담 하 지 못하 고 몹시 겁 이 많
간땡이 를 키우,담력 과 도량 을 늘리
간발 의 차이,서로 엇비슷 하 ᆯ 정도 의 아주 작 은 차이
간언 들,잘 어울리 는 일 에 이간 하 는 말 이 끼어들
간언 이 들,잘 어울리 는 일 에 이간 하 는 말 이 끼어들
간 에 기별 도 안 가,먹 은 것 이 너무 적 어 먹 으나 마나 하
간 에 차 지 않,마음 에 흡족히 여기 어 지 지 않
간 을 꺼내 어 주,비위 를 맞추 기 위하 아 중요 하 ᆫ 것 을 아낌없이 주
간 을 녹이,몹시 애타 게 하
간 이 녹,몹시 애 가 타
간 이 덜렁 하,몹시 놀라 아 충격 을 받
간 이 덜렁 하,몹시 놀라 아 충격 을 받
간 이 덜렁 하,몹시 놀라 아 충격 을 받
간 이 떨리,마음 속 으로 몹시 겁 이
간 이 라도 빼 어 주 ᆯ 듯,무엇 이라도 아낌없이 내주 ᆯ 듯
간 이 라도 뽑 아 주 ᆯ 듯,무엇 이라도 아낌없이 내주 ᆯ 듯
간 이 라도 빼 어 먹이 ᆯ 듯,무엇 이라도 아낌없이 내주 ᆯ 듯
간 이 벌름거리,몹시 두렵 거나 놀랍 어 가슴 이 두근거리
간 이 서늘 하,위험 하 고 두렵 어 매우 놀라
간 이 오그라들,몹시 두렵 어 지 거나 무섭 어 지
간 이 오르,간 이 배어들
간 이 조마조마 하,마음 이 초조 하 고 불안 하
간 이 콩 알 만 하,몹시 겁 이 나서 기 를 펴 지 못하
간 이 콩 알 만 하 아 지,몹시 두렵 어 지 거나 무섭 어 지
간장 을 끊,몹시 애 가 타 거나 슬프
간장 을 녹이,몹시 애타 게 하
간장 을 태우,마음 을 몹시 초조 하 고 불안 하 게 만들
간장 이 끊 어 지,슬픔 이나 분노 따위 가 너무 크 어서 참 기 어렵
간장 이 녹,몹시 애 가 타
간장 이 사라지,몹시 놀라 거나 실망 하
간장 이 썩,마음 이 몹시 상하
간장 이 타,조바심 과 걱정 으로 속 이 끓
간판 따,겉 으로 내세우 기 위하 아 학력 이나 명분 을 갖추
간판 을 따,겉 으로 내세우 기 위하 아 학력 이나 명분 을 갖추
간판 을 걸,개업 을 하 거나 단체 따위 가 활동 을 시작 하
간판 을 내리,폐업 을 하 거나 단체 따위 가 활동 을 중지 하
간 힘 주,간 힘 을 아랫 배 에 내리밀
간 힘 을 주,간 힘 을 아랫 배 에 내리밀
가 ᆯ 켜,기둥 의 사개 나 인방 의 가름 장 따위 의 갈 을 만들 기 위하 여 톱 질 을 하
갈 을 켜,기둥 의 사개 나 인방 의 가름 장 따위 의 갈 을 만들 기 위하 여 톱 질 을 하
가 ᆯ 타,기둥 의 사개 나 인방 의 가름 장 의 갈 을 만들
갈 을 타,기둥 의 사개 나 인방 의 가름 장 의 갈 을 만들
가 ᆯ 길 이 멀,앞 으로 하 아야 하 ᆯ 일 들 이 많이 남 아 있
가 ᆯ 데 까지 가,도달 하 ᆯ 수 있 는 가장 극단 의 상태 나 상황 이 되
갈림 길 에 서,선택 을 하 아야 하 는 위치 에 놓이
갈비 휘,갈비 뼈 가 휘 ᆯ 정도 로 책임 이나 짐 이 무겁
갈비 가 휘,갈비 뼈 가 휘 ᆯ 정도 로 책임 이나 짐 이 무겁
갈빗 대 휘,갈빗 대 가 휘 ᆯ 정도 로 책임 이나 짐 이 무겁
갈빗 대 가 휘,갈빗 대 가 휘 ᆯ 정도 로 책임 이나 짐 이 무겁
갈지 자 를 그리,똑바로 걷 지 아니하 고 이리 비틀 저리 비틀 하 며 걷
감옥 귀신 을 만들,감옥 에서 죽 게 하
감옥 신세 를 지,감옥 살이 하
감정 사,남 의 감정 을 언짢 게 만들
감정 을 사,남 의 감정 을 언짢 게 만들
감정 오르,언짢 은 마음 이 생기
감정 이 오르,언짢 은 마음 이 생기
감정 을 잡,분위기 에 맞 는 감정 을 충분히 소화 하 여 감정 을 표현 하
감정 을 해치,남 을 불쾌 하 게 하
감 중련 을 하,입 을 다물 고 말 을 하 지 않
감투 쓰,벼슬 자리 나 높 은 지위 에 오르
감투 를 쓰,벼슬 자리 나 높 은 지위 에 오르
감투 를 벗,벼슬 자리 를 그만두
감투 를 씌우,벼슬 자리 나 높 은 지위 에 오르 게 만들
값 보다,사려 는 물건 의 값 을 어림 하 여 보
값 을 보,사려 는 물건 의 값 을 어림 하 여 보
값 닿,물건 흥정 에서 사 거나 팔 기 에 알맞 은 값 에 이르
값 이 닿,물건 흥정 에서 사 거나 팔 기 에 알맞 은 값 에 이르
강 바치,배우 ᆫ 글 을 스승 앞 에서 외어 올리
강 을 바치,배우 ᆫ 글 을 스승 앞 에서 외어 올리
강 받,자기 가 듣 는 앞 에서 글 을 외 어 바치 게 하
강 을 받,자기 가 듣 는 앞 에서 글 을 외 어 바치 게 하
강 건너 어 불 구경,자기 에게 관계없 는 일 이 라고 하 여 무 관심 하 게 방관 하
강 건너 어 불 보,자기 에게 관계없 는 일 이 라고 하 여 무 관심 하 게 방관 하
강단 에 서,교직 생활 을 하
강목 치,아무런 소득 없이 허탕 을 치
강목 치르,아무런 소득 없이 허탕 을 치
강목 을 치,아무런 소득 없이 허탕 을 치
강목 을 치르,아무런 소득 없이 허탕 을 치
강 풀 치,풀 을 먹이 ᆫ 위 에 또 된 풀 을 칠하
강 풀 을 치,풀 을 먹이 ᆫ 위 에 또 된 풀 을 칠하
갖 고 놀,사람 을 놀리 거나 멸시 하
같 은 값 에,이렇게 하 든지 저렇게 하 든지 물질 이나 노력 이 드 는 정도 가 마찬가지 이 ㄴ데
같 은 값 이 면,값 이나 힘 이 드 는 정도 가 같 을 바 에 는
같 은 물 에 놀,같 은 환경 에서 하 ᆫ 데 몰려다니 며 같 은 짓 을 하
개가 를 올리,크 ᆫ 성과 를 거두
개 나발 불,사리 에 맞 지 아니하 는 헛 소리 를 하
개 나발 을 불,사리 에 맞 지 아니하 는 헛 소리 를 하
개 떡 같이 주무르,저 의 마음 대로 함부로 다루
개 똥 도 모르 ᆫ다,아무것 도 모르 ᆫ다
개 똥 도 없,아무것 도 없
개미 새끼 하나 도 얼씬 못 하 ᆫ다,허락 되 ᆫ 사람 외 에 는 아무 도 얼씬 하 지 못하 ᆫ다
개미 새끼 하나 보 ᆯ 수 없,아무 도 찾아보 ᆯ 수 없
개 발 싸개 같,보잘것없이 허름 하 고 빈약 하
개 발 에 땀 나,해내 기 어렵 ᆫ 일 을 이루 기 위하 여 부지런히 움직이
개 방귀 같,있 는지 조차 알 ᆯ 수 없 을 정도 로 작 고 시시 하
개 뿔 도 모르,아무것 도 모르
개 뿔 도 아니,특별히 내세우 ᆯ 만 하 ᆫ 능력 이 없
개 뿔 도 없,"돈 이나 명예 , 능력 따위 를 전혀 갖 고 있 지 아니하"
개 살구 먹 은 뒷 맛,씁쓸 하 고 떨떠름 하 ᆫ 뒷 맛
개 새끼 한 마리 얼씬 하 지 않,아무것 도 다니 지 않 고 조용 하
개 소리 치,당하 지 않 은 말 을 마구 지껄이
개 소리 를 치,당하 지 않 은 말 을 마구 지껄이
개 싸대,아무 데 나 함부로 마구 쏘다니
개암 도르,매가 먹 었 던 먹이 에서 고기 는 삭이 고 개암 만 토하 아 내
개암 을 도르,매가 먹 었 던 먹이 에서 고기 는 삭이 고 개암 만 토하 아 내
개암 지르,매 의 먹이 에 솜 뭉치 를 넣 어 주
개암 을 지르,매 의 먹이 에 솜 뭉치 를 넣 어 주
개 자리 지,모 를 내 ᆯ 때 모 포기 가 한 부분 만 성기 게 심 어 지 어서 층 이 지
개 자리 가 지,모 를 내 ᆯ 때 모 포기 가 한 부분 만 성기 게 심 어 지 어서 층 이 지
개 잡,개 를 잡 을 때 처럼 함부로 치 고 때리
개 콧 구멍 으로 알,시시 하 ᆫ 것 으로 알 아 대수롭 지 아니하 게 여기
개탕 치,장지 틀 이나 빈지 틀 따위 에 홈 을 파내
개탕 을 치,장지 틀 이나 빈지 틀 따위 에 홈 을 파내
개 패,함부로 때리 고 치
개평 떼,개평 을 얻 어 가지
개평 을 떼,개평 을 얻 어 가지
개평 뜯,조르 아서 억지로 개평 을 얻 어 가지
개평 을 뜯,조르 아서 억지로 개평 을 얻 어 가지
개화 물 먹,개화 사상 의 풍조 를 따르 거나 영향 을 받
개화 물 을 먹,개화 사상 의 풍조 를 따르 거나 영향 을 받
개화 물 이 들,개화 사상 의 풍조 를 긍정 하 고 따르 게 되
갱 달,광맥 을 따르 아 갱도 를 뚫
갱 을 달,광맥 을 따르 아 갱도 를 뚫
거간 을 서,거간 이 되 어 흥정 을 붙이 어 주
거꾸로 박히,머리 를 아래 로 하 고 떨어지
거듭 태어나,새롭 게 면모 를 갖추
거름 발 나,거름 효과 가 나
거리 가 멀,기대 하 거나 비교 하 는 것 에 미치 지 못하
거리 가 생기,관계 가 서먹서먹 하 아 지 거나 멀 어 지
거리 에 나앉,집 안 이 망하 아서 집 이 남 의 것 이 되 어 오가 ᆯ 데 가 없
거미 새끼 풍기,많 은 사람 이나 물건 이 일시 에 흩어지
거미 새끼 흩어지,많 은 사람 이나 물건 이 일시 에 흩어지
거미 새끼 헤어지,많 은 사람 이나 물건 이 일시 에 흩어지
거미 알 까 듯,어수선 하 고 산만 하 게 흩어지 어 있 는 모양
거미 알 스 ㄹ 듯,어수선 하 고 산만 하 게 흩어지 어 있 는 모양
거미 줄 누르,"방 에 구들 을 놓 을 때 , 구들 장 과 구들 장 사이 의 틈 을 진 흙 으로 바르"
거미 줄 을 누르,"방 에 구들 을 놓 을 때 , 구들 장 과 구들 장 사이 의 틈 을 진 흙 으로 바르"
거미 줄 늘이,피의 자 나 죄인 을 잡 기 위하 여 여러 방면 에 수사 망 을 널리 펴 어 놓
거미 줄 을 늘이,피의 자 나 죄인 을 잡 기 위하 여 여러 방면 에 수사 망 을 널리 펴 어 놓
거북 을 타,일 하 는 동작 이 남 보다 매우 굼뜨
거상 치,거상 하 는 풍악 을 치
거상 을 치,거상 하 는 풍악 을 치
거지 밥 주머니,너절 하 ᆫ 것 들 을 되 는 대로 뒤섞 어 넣 어 두 ᆫ 것
거지 술 안주,시시 하 고 보 잘 것 없 는 음식
거지 술 안주 같,시시 하 고 보 잘 것 없 는 음식
거짓 말 보태,실지 보다 더 보태 어 과장 하 아서 말 하
거짓 말 을 보태,실지 보다 더 보태 어 과장 하 아서 말 하
거칠 ᆯ 것 이 없,일 이 순조 롭 어서 막히 ᄆ 이 없
거품 물,감정 이 몹시 격하 아 지 ᆫ 상태 로 말 하
거품 을 물,감정 이 몹시 격하 아 지 ᆫ 상태 로 말 하
거품 치,차 ᆫ 공기 따위 를 쐬 어 거품 을 없애
거품 을 치,차 ᆫ 공기 따위 를 쐬 어 거품 을 없애
거품 잦,한창 성 하 던 것 이 맥없이 쓰러지
거품 이 잦,한창 성 하 던 것 이 맥없이 쓰러지
거품 을 품,감정 이 몹시 격하 아 지 어 흥분 하
걱정 을 잡아매,걱정 을 하 지 않 거나 그만두
걱정 이 태산 이,해결 하 아야 하 ᆯ 일 이 너무 많 거나 복잡 하 아서 걱정 이 태산 처럼 크
건넛 마을 불 구경 하,자기 에게 관계없 는 일 이 라고 하 여 무 관심 하 게 방관
건목 치,대강 짐작 하 여 정하
건목 을 치,대강 짐작 하 여 정하
건 몸 달,공연히 혼자 서 만 애쓰 며 안달 하
건 몸 을 달,공연히 혼자 서 만 애쓰 며 안달 하
건시 나 감 이나,결국 크 ᆫ 차이 없이 비슷비슷 하 ᆫ 물건
건즐 받들,여자 가 아내 나 첩 이 되
건즐 을 받들,여자 가 아내 나 첩 이 되
걸귀 들리 ᆫ 듯이,음식 을 지나치 게 탐내
걸귀 가 들리 ᆫ 듯이,음식 을 지나치 게 탐내
걸립 놀,걸립 의 행사 를 하
걸립 을 놀,걸립 의 행사 를 하
걸음 마 를 떼,처음 시작 하
걸음 마 를 타,이제 겨우 익히 기 시작 하
걸음 발 타,비틀거리 며 걷 기 시작 하
걸음 발 을 타,비틀거리 며 걷 기 시작 하
걸음 아 나 ᆯ 살리 어라,있 는 힘 을 다 하 여 매우 다급 하 게 도망치
걸음 을 떼,준비 하 아 오 던 일 을 처음 으로 하 기 시작 하
걸음 을 재촉 하,빨리 서두르 어 가
걸음 을 하,웃 어른 이나 지위 가 높 은 사람 이 들르
검 은 구름,암담 하 ᆫ 상황
검 은 마수 를 뻗치,사람 을 속이 어 이용 하 거나 해치 려고 음흉 하 고 흉악 하 ᆫ 속 셈 으로 접근 하
검 은 손 을 뻗치,사람 을 속이 어 이용 하 거나 해치 려고 음흉 하 고 흉악 하 ᆫ 속 셈 으로 접근 하
검 은 뱃 속 을 채우,더럽 ᆫ 속 셈 을 가지 고 자기 의 욕심 을 채우
검정 개 한 마리 얼씬 하 지 않,아무것 도 다니 지 않 고 조용 하
겁 질리,잔뜩 겁 을 먹 어서 기 를 못 쓰
겁 에 질리,잔뜩 겁 을 먹 어서 기 를 못 쓰
겉 물 돌,액체 의 위 에 겉 물 이 뜨 어서 돌
겉 물 이 돌,액체 의 위 에 겉 물 이 뜨 어서 돌
겉 으로 빙빙 돌,사물 의 핵심 을 파헤치 지 않 고 겉 에 나타나 ᆫ 현상 에 만 매달리
게걸 떼,마음껏 먹 어서 더 먹 고 싶 은 마음 이 없 어 지
게걸 을 떼,마음껏 먹 어서 더 먹 고 싶 은 마음 이 없 어 지
게 걸음 치,걸음 이 몹시 느리 거나 사업 이 발전 이 없
게 걸음 을 치,걸음 이 몹시 느리 거나 사업 이 발전 이 없
게 눈 감추,음식 을 허겁지겁 빨리 먹 어 치우
겨냥 대,활 이나 총 을 쏘 ᆯ 때 목표 물 에 맞 도록 어림 을 잡
겨냥 을 대,활 이나 총 을 쏘 ᆯ 때 목표 물 에 맞 도록 어림 을 잡
겨냥 보다,실물 에 맞 는 치수 와 양식 을 정하 기 위하 여 맞추 어 보
겨냥 을 보,실물 에 맞 는 치수 와 양식 을 정하 기 위하 여 맞추 어 보
겨린 잡,살인 범 의 이웃 사람 이나 범죄 현장 근처 로 지나가 는 사람 을 증인 으로 잡아가
겨린 을 잡,살인 범 의 이웃 사람 이나 범죄 현장 근처 로 지나가 는 사람 을 증인 으로 잡아가
겨린 잡히,살인 범 의 이웃 사람 이나 범죄 현장 근처 를 지나가 는 사람 이 증인 으로 불리 어 가
겨린 을 잡히,살인 범 의 이웃 사람 이나 범죄 현장 근처 를 지나가 는 사람 이 증인 으로 불리 어 가
격 두,사람 과 사람 사이 에 일정 하 ᆫ 간격 을 두
격 을 두,사람 과 사람 사이 에 일정 하 ᆫ 간격 을 두
격 치,"윷 놀이 에서 , 가깝 ᆫ 밭 으로 가 ᆯ 수 있 게 바라 는 끗 수 를 내"
격 을 치,"윷 놀이 에서 , 가깝 ᆫ 밭 으로 가 ᆯ 수 있 게 바라 는 끗 수 를 내"
견련 보다,서로 가 속 으로 은근히 꺼리 거나 겁내
견련 을 보,서로 가 속 으로 은근히 꺼리 거나 겁내
결 바르,성미 가 곧 고 바르
결 이 바르,성미 가 곧 고 바르
결 삭,성 이 나 ᆫ 마음 이 풀리 어 부드럽 어 지
결 이 삭,성 이 나 ᆫ 마음 이 풀리 어 부드럽 어 지
결박 짓,결박 을 단단히 하
결박 을 짓,결박 을 단단히 하
결 을 삭이,성 이 나 ᆫ 마음 을 풀 어 가라앉히
결창 터지,몹시 분하 여 속 이 터지
결창 이 터지,몹시 분하 여 속 이 터지
겻 섬 털 ᆯ 듯,무슨 일 을 함부로 하
경마 들,남 이 타 ᆫ 말 의 고삐 를 잡 고 몰 고 가
경마 를 들,남 이 타 ᆫ 말 의 고삐 를 잡 고 몰 고 가
경마 잡,남 이 타 ᆫ 말 의 고삐 를 잡 고 몰 고 가
경마 를 잡,남 이 타 ᆫ 말 의 고삐 를 잡 고 몰 고 가
경마 잡히,말 고삐 를 남 에게 잡히 어 몰 고 가 게 하
경마 를 잡히,말 고삐 를 남 에게 잡히 어 몰 고 가 게 하
경신 새,섣 달 중 의 경신 에 해당 하 는 날 에 밤 을 새우
경신 을 새,섣 달 중 의 경신 에 해당 하 는 날 에 밤 을 새우
